<h2 dir="auto"> Genitive </h2>*<div class="richtext-content-container"> <p>German has four cases: nominative, accusative, dative and genitive. We use the genitive to express possession or ownership.</p> <p>We can give more detail about a noun with an additional noun in the genitive case, known as a genitive attribute. The genitive attribute tells us who something belongs to.<br/> <br/> <strong>Noun as genitive attribution</strong></p> <p>If the genitive attribute is not a proper name, it generally comes after the noun that it is modifying.</p> <p><em>Ist das deine Kaffeetasse?<br/> Nein, das ist die Kaffeetasse <strong>des Regisseurs</strong>. </em></p> <p><em>Ist das Nicos Hut?<br/> Nein, das ist der Hut <strong>der Schauspielerin</strong>. </em></p> <p><em>Sind das unsere Drehbücher?<br/> Nein, das sind die Drehbücher <strong>des Kamerateams</strong>. </em></p> <p><em>Sind das eure Mikrofone?<br/> Nein, das sind die Mikrofone <strong>der Tonassistenten</strong>. </em><br/> <br/> In the genitive, the articles of nouns change. Also, the ending <em>-s</em> is added to most masculine and neuter nouns. Feminine and plural nouns do not take an ending.</p> <div class="tab-wrap"> <table> <tbody> <tr> <td> </td> <td>Genitive</td> </tr> <tr> <td>Masculine</td> <td> </td> </tr> <tr> <td>der/ein Regisseur</td> <td><em><strong>des/eines</strong></em> Regisseur<em><strong>s</strong></em></td> </tr> <tr> <td>Feminine</td> <td> </td> </tr> <tr> <td>die/eine Schauspielerin</td> <td><strong><em>der/einer</em></strong> Schauspielerin</td> </tr> <tr> <td>Neuter</td> <td> </td> </tr> <tr> <td>das/ein Kamerateam</td> <td><strong><em>des/eines </em></strong>Kamerateam<strong><em>s</em></strong></td> </tr> <tr> <td>Plural</td> <td> </td> </tr> <tr> <td>Tonassistenten</td> <td><strong><em>der</em> </strong>Tonassistenten</td> </tr> </tbody> </table> </div> <p><br/> Nouns ending in an s-sound (<em>-s</em>, <em>-ß</em>, <em>-z </em>or <em>-x</em>), always form the genitive with the ending <em>-es</em>.</p> <p><em>Herr Friese ist der Besitzer <strong>des</strong> Haus<strong>es</strong>.</em><br/> <br/> Both endings are often possible, especially with single-syllable nouns:</p> <p><em>Das Ende <strong>des</strong> Film<strong>(e)s</strong> ist sehr traurig.</em></p> <p><em>Der Autor <strong>des </strong>Buch<strong>(e)s</strong> ist ein berühmter Schriftsteller.</em></p> <p> </p> <div class="tab-wrap"> <table> <tbody> <tr> <td> <p>Grammatical terms in German:</p> der Genitiv: In German, there are four different forms or categories of noun (cases), called <em>Fälle</em> or <em>Kasus</em>. As well as nominative, accusative, and dative, there is genitive. Nouns take the genitive when they follow certain prepositions or give more information about another noun. With the genitive attribute, we express possession or ownership. The articles take the forms: <em>des/eines, der/einer, des/eines, der/-</em>. Masculine and neuter nouns as well as proper nouns often add an <em>-s</em> at the end.</td> </tr> </tbody> </table> </div> <p> </p> </div>
<h2 dir="auto"> Relative clauses + preposition (1) </h2>*<div class="richtext-content-container"> <p><strong>Relative clauses: relative pronouns after dative prepositions</strong></p> <p>If a relative pronoun has to be connected to the verb with a preposition, the preposition in the relative clause comes directly before the relative pronoun. The case of the relative pronoun corresponds to the preposition: If the relative pronoun follows a preposition that takes the dative, it also takes the dative.</p> <p><em>Pepe ist Nicos <strong>Bruder</strong>. Er hatte mit <strong>ihm</strong> (= <strong>dem Bruder</strong>) schon oft Streit.<br/> Pepe ist Nicos Bruder, mit <strong>dem</strong> er schon oft Streit hatte.</em><br/> <br/> <em>Pepe hat <strong>Bekannte</strong>. Nico kann bei <strong>ihnen</strong> (= <strong>den Bekannten</strong>) ein Praktikum machen.<br/> Pepe hat <strong>Bekannte</strong>, bei <strong>denen</strong> Nico ein Praktikum machen kann.</em></p> <p>Do you remember? The prepositions <em>aus</em>, <em>von</em>, <em>bei</em>, <em>zu</em>, <em>mit</em>, <em>ab, nach</em> and <em>seit</em> always take the dative.</p> </div>
<h2 dir="auto"> Dative instead of genitive </h2>*<div class="richtext-content-container"> <p>In spoken language, we often use <em>von</em> + dative instead of the genitive.</p> <p>Genitive:</p> <p><em>Der Autor <strong>des Buches</strong> ist ein berühmter Schriftsteller.</em></p> <p><em>von </em>+ Dative:</p> <p><em>Der Autor <strong>von dem Buch</strong> ist ein berühmter Schriftsteller.</em><br/> <br/> When the noun attributing possession or ownership is plural and indefinite, meaning it has no article or adjective, it cannot take the genitive. In this case, we use <em>von</em> + dative.</p> <p>Noun <strong>with</strong> article: genitive</p> <p><em>Das sind die Mikrofone</em> <strong><em>der Tonassistenten</em></strong>. (A specific group of sound engineers is being referred to.)</p> <p>but:</p> <p>Noun <strong>without</strong> article: <em>von</em> + dative</p> <p><em>Das sind die Mikrofone von <strong>Tonassistenten</strong>.</em> (Some unidentified sound engineers are being referred to.)</p> </div>
<h2 dir="auto"> Second nominative </h2>*<div class="richtext-content-container"> <p>The subject of a sentence is always in the nominative.</p> <p><strong><em>Der Mann</em></strong><em> kommt aus Frankreich.</em></p> <p>Sometimes there is also a second nominative in the sentence, e.g. with the verb <em>sein</em>:</p> <p><strong><em>Der Mann </em></strong><em>ist<strong> ein Feinschmecker.</strong></em></p> <p>The second nominative gives more detail about the subject. It can only be used with a few verbs, e.g., <em>werden </em>and <em>bleiben </em>as well as <em>sein</em>. These verbs link the subject to a noun in the nominative.</p> <p> </p> <p><strong>Nominative articles</strong></p> <p>Here is another overview of some nominative articles that you have already studied.</p> <div class="tab-wrap"> <table> <tbody> <tr> <td> </td> <td>Nominative</td> </tr> <tr> <td>Masculine</td> <td> <p><strong>der</strong></p> </td> </tr> <tr> <td> </td> <td> <p><strong>ein</strong></p> </td> </tr> <tr> <td> </td> <td> <p><strong>kein</strong></p> </td> </tr> <tr> <td> </td> <td><strong>mein</strong></td> </tr> <tr> <td>Feminine</td> <td> <p>die</p> </td> </tr> <tr> <td> </td> <td> <p>eine</p> </td> </tr> <tr> <td> </td> <td> <p>keine</p> </td> </tr> <tr> <td> </td> <td>meine</td> </tr> <tr> <td>Neuter</td> <td> <p>das</p> </td> </tr> <tr> <td> </td> <td> <p>ein</p> </td> </tr> <tr> <td> </td> <td> <p>kein</p> </td> </tr> <tr> <td> </td> <td>mein</td> </tr> <tr> <td>Plural</td> <td> <p>die</p> </td> </tr> <tr> <td> </td> <td> <p>-</p> </td> </tr> <tr> <td> </td> <td> <p>keine</p> </td> </tr> <tr> <td> </td> <td>meine</td> </tr> </tbody> </table> </div> <p> </p> </div>
<h2 dir="auto"> Personal pronouns: dative </h2>*<div class="richtext-content-container"> <p><strong>Personal pronouns in the dative case</strong></p> <p>Personal pronouns can take the nominative case and other cases as well; for example a personal pronoun can be used after certain prepositions or verbs in the accusative. Other prepositions or verbs take the dative.</p> <p>Nominative: <em>Vermisst <strong>du</strong> spanisches Essen?</em></p> <p>Accusative: <em>Wir haben für <strong>dich</strong> Paella gekocht.</em></p> <p>Dative: <em>Schmeckt <strong>dir</strong> die Paella?</em><br/>  </p> <div class="tab-wrap"> <table> <tbody> <tr> <td>Nominative</td> <td>Accusative</td> <td>Dative</td> </tr> <tr> <td>ich</td> <td>mich</td> <td>mir</td> </tr> <tr> <td>du</td> <td>dich</td> <td>dir</td> </tr> <tr> <td>er</td> <td>ihn</td> <td>ihm</td> </tr> <tr> <td>sie</td> <td>sie</td> <td>ihr</td> </tr> <tr> <td>es</td> <td>es</td> <td>ihm</td> </tr> <tr> <td>wir</td> <td>uns</td> <td>uns</td> </tr> <tr> <td>ihr</td> <td>euch</td> <td>euch</td> </tr> <tr> <td>sie</td> <td>sie</td> <td>ihnen</td> </tr> <tr> <td>Sie</td> <td>Sie</td> <td>Ihnen</td> </tr> </tbody> </table> </div> </div>
<h2 dir="auto"> Verbs with two objects </h2>*<div class="richtext-content-container"> <p><strong>Verbs with a dative and an accusative object</strong></p> <p>At the center of every German sentence is the conjugated verb. As well as the subject, many verbs also require an object; in most cases, this is an accusative object.</p> <p>Some verbs can take a second object as well as the accusative object. The second object is often a dative object. Verbs that take two objects include those related to giving, taking and saying, i.e., <em>geben</em>, <em>schenken</em>, <em>schicken</em>, <em>bringen</em>, <em>zeigen</em> and <em>leihen</em>.</p> <p> <picture> <source media="(min-width: 1024px)" srcset="/image/38303711_507.jpg"> <source media="(min-width: 768px)" srcset="/image/38303711_505.jpg"> <source media="(min-width: 480px)" srcset="/image/38303711_503.jpg"> <img alt="Deutschkurse | Nicos Weg | Grammatik_A2_E15_L1_S1_Foto1" class="img-responsive" src="/image/38303711_507.jpg"/> </source></source></source></picture></p> <p><em>Ich schenke dir ein Wörterbuch.</em></p> <p>The subject in the nominative (<em>ich</em>) refers to the person performing the action. (<em>Wer?</em>)</p> <p>The dative object (<em>dir</em>) is the person who is receiving something. (<em>Wem?</em>)</p> <p>The accusative object (<em>ein Wörterbuch</em>) describes the item or thing being referred to. (<em>Was?</em>)</p> <p> </p> <p>In sentences or clauses with two objects, the <strong>dative</strong> comes before the accusative object when the accusative is not a pronoun.</p> <p><em>Ich gebe <strong>dir </strong>einen Stift.</em></p> <p><em>Ich gebe <strong>meinem</strong> <strong>Vater </strong>Schokolade.<br/> Ich gebe <strong>ihm </strong>Schokolade.</em></p> <p><em>Ich gebe <strong>meiner Mutter </strong>eine DVD.<br/> ich gebe <strong>ihr </strong>eine DVD.</em></p> <p><em>Ich gebe <strong>meinen Eltern </strong>ein Bild.<br/> Ich gebe <strong>ihnen </strong>ein Bild.</em></p> <p><br/> The dative object can be either a noun or a pronoun. If you need to, go through the personal pronouns in the dative again.</p> <div class="tab-wrap"> <table> <tbody> <tr> <td>Nominative</td> <td>Dative</td> </tr> <tr> <td>ich<br/> du<br/> er<br/> sie<br/> es</td> <td>mir<br/> dir<br/> ihm<br/> ihr<br/> ihm</td> </tr> <tr> <td>wir<br/> ihr<br/> sie<br/> Sie</td> <td>uns<br/> euch<br/> ihnen<br/> Ihnen</td> </tr> </tbody> </table> </div> <p> </p> </div>
<h2 dir="auto"> Negation: nicht/kein </h2>*<div class="richtext-content-container"> <p><strong>Negation with</strong><strong> <em>nicht</em></strong></p> <p>The word <em>nicht</em> can be used to negate an entire sentence or a word or group of words.</p> <p> </p> <p>If the word <em>nicht</em> is used to negate a word or group of words, then the word <em>nicht</em> is placed directly before the word it is negating.</p> <p>Examples:</p> <p>Nouns with a direct article:<br/> <em>Sind das die Birnen von Klara? – Nein, das sind <strong>nicht</strong> <strong>die Birnen</strong> von Klara.</em></p> <p>Adjectives:<br/> <em>Sind die Birnen frisch? – Nein, die Birnen sind <strong>nicht</strong> <strong>frisch</strong>.</em></p> <p>Adverbs:<br/> <em>Isst Inge gerne Birnen? – Nein, Inge isst <strong>nicht gerne</strong> Birnen.</em></p> <p> </p> <p>If an entire sentence is being negated, then <em>nicht </em>comes at or near the end of the sentence.</p> <p><em>Isst Inge die Birnen? – Nein, Inge isst die Birnen <strong>nicht</strong>.<br/> Möchte Inge die Birnen essen? – Nein, sie möchte die Birnen <strong>nicht</strong> essen.</em></p> <p> </p> <p><br/> <strong>Negation with <em>kein</em></strong></p> <p>With <em>kein</em>, we negate nouns with indefinite articles and most nouns with no article.</p> <p>Nouns with an indefinite article:<br/> <em>Ist das <strong>ein</strong> Apfel? – Nein, das ist <strong>kein</strong> <strong>Apfel</strong>. Das ist eine Birne.</em></p> <p>Most nouns with no article:<br/> <em>Isst Inge Birnen? – Nein, Inge isst <strong>keine</strong> <strong>Birnen</strong>.</em></p> <p>The word <em>kein</em> changes form. In the singular, it takes the form of the indefinite article.</p> </div>
<h2 dir="auto"> Negatives: nicht </h2>*<div class="richtext-content-container"> <p>Adjectives are made negative with <em>nicht</em>.</p> <p><em>Das Zimmer ist <strong>klein</strong>.<br/> Das Zimmer ist <strong>nicht groß</strong>.</em></p> <p><em>Das Zimmer ist <strong>dunkel</strong>.<br/> Das Zimmer ist <strong>nicht hell</strong>.</em></p> </div>
<h2 dir="auto"> Article: negation </h2>*<div class="richtext-content-container"> <p>When we use the word <em>kein,</em> a noun with an indefinite article, or no article, becomes negative.</p> <p> </p> <p><strong>Singular</strong></p> <p>The endings of <em>kein</em> are identical to the endings of the indefinite article <em>ein</em> in the singular.</p> <p> </p> <p> <picture> <source media="(min-width: 1024px)" srcset="/image/38290333_507.jpg"> <source media="(min-width: 768px)" srcset="/image/38290333_505.jpg"> <source media="(min-width: 480px)" srcset="/image/38290333_503.jpg"> <img alt="Deutschkurse | Nicos Weg | Grammatik_A1_E05_L3_S3_Foto1" class="img-responsive" src="/image/38290333_507.jpg"/> </source></source></source></picture></p> <p> <picture> <source media="(min-width: 1024px)" srcset="/image/38290320_507.jpg"> <source media="(min-width: 768px)" srcset="/image/38290320_505.jpg"> <source media="(min-width: 480px)" srcset="/image/38290320_503.jpg"> <img alt="Deutschkurse | Nicos Weg | Grammatik_A1_E05_L3_S3_Foto2" class="img-responsive" src="/image/38290320_507.jpg"/> </source></source></source></picture></p> <p> <picture> <source media="(min-width: 1024px)" srcset="/image/38290385_507.jpg"> <source media="(min-width: 768px)" srcset="/image/38290385_505.jpg"> <source media="(min-width: 480px)" srcset="/image/38290385_503.jpg"> <img alt="Deutschkurse | Nicos Weg | Grammatik_A1_E05_L3_S3_Foto3" class="img-responsive" src="/image/38290385_507.jpg"/> </source></source></source></picture></p> <p>The same applies to the accusative:</p> <p> <picture> <source media="(min-width: 1024px)" srcset="/image/38290345_507.jpg"> <source media="(min-width: 768px)" srcset="/image/38290345_505.jpg"> <source media="(min-width: 480px)" srcset="/image/38290345_503.jpg"> <img alt="Deutschkurse | Nicos Weg | Grammatik_A1_E05_L3_S3_Foto4" class="img-responsive" src="/image/38290345_507.jpg"/> </source></source></source></picture></p> <p><strong>Plural</strong></p> <p>A noun that is used in the plural without an article is made negative using <em>keine</em>.</p> <p> <picture> <source media="(min-width: 1024px)" srcset="/image/38290358_507.jpg"> <source media="(min-width: 768px)" srcset="/image/38290358_505.jpg"> <source media="(min-width: 480px)" srcset="/image/38290358_503.jpg"> <img alt="Deutschkurse | Nicos Weg | Grammatik_A1_E05_L3_S3_Foto5" class="img-responsive" src="/image/38290358_507.jpg"/> </source></source></source></picture></p> <div class="tab-wrap"> <table> <tbody> <tr> <td> </td> <td>Nominative</td> <td>Accusative</td> </tr> <tr> <td>masculine<br/> (<em>der</em>)</td> <td>ein<br/> kein</td> <td>einen<br/> keinen</td> </tr> <tr> <td>feminine<br/> (<em>die</em>)</td> <td>eine<br/> keine</td> <td>eine<br/> keine</td> </tr> <tr> <td> <p>neuter<br/> (<em>das</em>)</p> </td> <td>ein<br/> kein</td> <td>ein<br/> kein</td> </tr> <tr> <td>plural<br/> (<em>die</em>)</td> <td>-<br/> keine</td> <td>-<br/> keine</td> </tr> </tbody> </table> </div> <p> </p> <p><strong>Singular without article</strong></p> <p>In addition, nouns that are used in the singular without an article are made negative using the corresponding form of <em>kein</em>.</p> <p>Isst Nina Schinken? – Nein, Nina isst <strong>keinen</strong> Schinken.</p> <p>Trinkst du Cola? – Nein, ich trinke <strong>keine</strong> Cola.</p> <p>Möchtest du Bier? – Nein, ich möchte <strong>kein</strong> Bier.</p> </div>
<h2 dir="auto"> Question words: case </h2>*<div class="richtext-content-container"> <p><strong><em>Mit wem</em></strong><em> feierst du Silvester? Mit deiner Familie?</em></p> <p><strong><em>Mit wem</em></strong><em> feiert Sebastian Karneval? - Mit seinen Freunden. </em></p> <p>We use the question word <em>wem </em>to ask about people in the dative case. The question word can also be used with a preposition that takes the dative: <em>Mit wem?</em></p> <p> </p> <div class="tab-wrap"> <table> <tbody> <tr> <td>Case</td> <td>Question word</td> </tr> <tr> <td>Nominative</td> <td><em>Wer?</em></td> </tr> <tr> <td>Accusative</td> <td><em>Wen?</em></td> </tr> <tr> <td>Dative</td> <td><em>Wem?</em></td> </tr> </tbody> </table> </div> <p><br/> Examples:</p> <p><strong><em>Wer</em></strong><em> ist das? – Das ist mein Freund. / Das ist meine Freundin.</em>  (Nominative)</p> <p><strong><em>Wen</em></strong><em> triffst du später? – Ich treffe meinen Freund. / Ich treffe meine Freundin.</em> (Accusative)</p> <p><strong><em>Wem</em></strong><em> gehört das? – Das gehört meinem Freund. / Das gehört meiner Freundin. </em>(Dative)</p> <p><em>Mit <strong>wem</strong> telefonierst du? – Ich telefoniere mit meinem Freund. / Ich telefoniere mit meiner Freundin.</em> (Dative)</p> </div>
<h2 dir="auto"> Sentence construction: pronouns </h2>*<div class="richtext-content-container"> <p><strong>Verbs with dative and accusative objects: pronouns as objects</strong></p> <p>The dative object or the accusative object can be a pronoun, if the person listening or reading already knows which person or object is being referred to.</p> <p>A pronoun can replace the dative object:</p> <p><em>Was schenkst du <strong>deinem Bruder</strong>?<br/> Ich schenke <strong>ihm</strong> ein Buch.</em></p> <p><em>Was schenkst du <strong>deiner Schwester</strong>?<br/> Ich schenke <strong>ihr</strong> einen Fußball.</em></p> <p><em>Was schenkst du <strong>deinen Großeltern</strong>?<br/> Ich schenke <strong>ihnen</strong> ein Familienfoto.</em></p> <p> </p> <p>A pronoun can also replace the accusative object. In this case, though, it should be noted that if the accusative object is a pronoun, it comes before the dative. In this instance, it makes no difference whether the dative object is a noun or a pronoun.</p> <p> <picture> <source media="(min-width: 1024px)" srcset="/image/38303735_507.jpg"> <source media="(min-width: 768px)" srcset="/image/38303735_505.jpg"> <source media="(min-width: 480px)" srcset="/image/38303735_503.jpg"> <img alt="Deutschkurse | Nicos Weg | Grammatik_A2_E15_L2_S1_Foto1" class="img-responsive" src="/image/38303735_507.jpg"/> </source></source></source></picture></p> <p> <picture> <source media="(min-width: 1024px)" srcset="/image/38303723_507.jpg"> <source media="(min-width: 768px)" srcset="/image/38303723_505.jpg"> <source media="(min-width: 480px)" srcset="/image/38303723_503.jpg"> <img alt="Deutschkurse | Nicos Weg | Grammatik_A2_E15_L2_S1_Foto2" class="img-responsive" src="/image/38303723_507.jpg"/> </source></source></source></picture></p> <p>Have a look at the personal pronoun in the accusative again if you need to.</p> <div class="tab-wrap"> <table> <tbody> <tr> <td>Nominative</td> <td>Accusative</td> </tr> <tr> <td>ich</td> <td>mich</td> </tr> <tr> <td>du</td> <td>dich</td> </tr> <tr> <td>er</td> <td>ihn</td> </tr> <tr> <td>sie</td> <td>sie</td> </tr> <tr> <td>es</td> <td>es</td> </tr> <tr> <td>wir</td> <td>uns</td> </tr> <tr> <td>ihr</td> <td>euch</td> </tr> <tr> <td>sie</td> <td>sie</td> </tr> <tr> <td>Sie</td> <td>Sie</td> </tr> </tbody> </table> </div> <p> </p> </div>
<h2 dir="auto"> Reflexive pronouns </h2>*<div class="richtext-content-container"> <p><strong>Summary: personal pronouns and reflexive pronouns </strong></p> <p>You already know the personal pronouns and the reflexive pronouns. In the first- and second-person singular and plural, the personal pronouns and the reflexive pronouns are identical. There are differences only in the third-person singular and plural.<br/> Take another look at the differences.<br/> <br/> <br/> Accusative:<br/> <strong>Max und Tarek</strong> forgot the anniversary. <strong>Nico</strong> reminds them about it:<br/> <strong><em>Nico</em></strong><em> erinnert <strong>sie</strong> an das Jubiläum. </em>(The subject is not identical to the accusative object.)<br/> <br/> <strong>Max und Tarek</strong> have not forgotten the celebration. <strong>Max und Tarek</strong> remember it:<br/> <strong><em>Max und Tarek</em></strong><em> erinnern <strong>sich</strong> an das Jubiläum. </em>(The subject is identical to the accusative object.)</p> <p> </p> <div class="tab-wrap"> <table> <tbody> <tr> <td> <p>Personal<br/> <span style="background-color:transparent">pronouns</span></p> </td> <td> <p>Reflexive<br/> <span style="background-color:transparent">pronouns</span></p> </td> </tr> <tr> <td> <p>mich<br/> dich<br/> <strong><em>ihn</em></strong><br/> <strong><em>sie</em></strong><br/> <strong><em>es</em></strong></p> </td> <td> <p>mich<br/> dich<br/> <strong><em>sich</em></strong><br/> <strong><em>sich</em></strong><br/> <strong><em>sich</em></strong></p> </td> </tr> <tr> <td> <p>uns<br/> euch<br/> <strong><em>sie</em></strong><br/> <strong><em>Sie</em></strong></p> </td> <td> <p>uns<br/> euch<br/> <strong><em>sich</em></strong><br/> <strong><em>sich</em></strong></p> </td> </tr> </tbody> </table> </div> <p> </p> <p>Dative:<br/> <strong>Nico</strong> is looking for a job. <strong>Tarek</strong> hopes that he finds a job soon:<br/> <strong><em>Tarek </em></strong><em>wünscht <strong>ihm</strong> viel Erfolg. </em>(The subject is not identical to the dative object.)</p> <p><br/> <strong>Nico</strong> has a birthday soon. <strong>Nico</strong> would like to have a party:<br/> <strong><em>Nico</em></strong><em> wünscht <strong>sich</strong> eine Party mit vielen Gästen – besonders mit Selma! </em>(The subject is identical to the dative object.)<br/>  </p> <div class="tab-wrap"> <table> <tbody> <tr> <td> <p>Personal<br/> <span style="background-color:transparent">pronouns</span></p> </td> <td> <p>Reflexive<br/> <span style="background-color:transparent">pronouns</span></p> </td> </tr> <tr> <td> <p>mir<br/> dir<br/> <strong><em>ihm</em></strong><br/> <strong><em>ihr</em></strong><br/> <strong><em>ihm</em></strong></p> </td> <td> <p>mir<br/> dir<br/> <strong><em>sich</em></strong><br/> <strong><em>sich</em></strong><br/> <strong><em>sich</em></strong></p> </td> </tr> <tr> <td> <p>uns<br/> euch<br/> <strong><em>ihnen</em></strong><br/> <strong><em>Ihnen</em></strong></p> </td> <td> <p>uns<br/> euch<br/> <strong><em>sich</em></strong><br/> <strong><em>sich</em></strong></p> </td> </tr> </tbody> </table> </div> <p><br/> <br/> <br/>  </p> <div class="tab-wrap"> <table> <tbody> <tr> <td> <p>Grammatical terms in German:</p> <p><br/> Das Personalpronomen: Personal pronouns refer to people or things. The words <em>ich,</em> <em>du</em> and <em>Sie</em> are examples of personal pronouns.</p> <p><br/> <span style="background-color:transparent">Das Reflexivpronomen: Reflexive verbs are used with reflexive pronouns. This reflexive pronoun relates back to the subject. The basic form of the reflexive pronoun is </span><em>sich</em><span style="background-color:transparent">.</span></p> </td> </tr> </tbody> </table> </div> <p> </p> </div>
<h2 dir="auto"> Question words: welch- </h2>*<div class="richtext-content-container"> <p><strong><em>Welcher </em></strong><em>Salat ist am besten? – <strong>Der</strong> Salat „Fantasia“ schmeckt sehr gut.</em></p> <p><strong><em>Welchen</em></strong><em> Salat möchten Sie? – <strong>Den</strong> Salat „Fantasia“ bitte.</em></p> <p>The question word <em>welch-</em>, is used to ask about a particular person or thing or to select one thing from a larger number of items.</p> <p>The question word <em>welch- </em>appears before a noun and takes the same ending as that which a definite article would take. </p> <div class="tab-wrap"> <table> <tbody> <tr> <td> </td> <td>Nominative</td> <td>Accusative</td> </tr> <tr> <td>Masculine <em>(der)</em></td> <td><strong>welcher</strong></td> <td><strong>welchen</strong></td> </tr> <tr> <td>Feminine <em>(die)</em></td> <td>welche</td> <td>welche</td> </tr> <tr> <td>Neuter  <em>(das)</em></td> <td>welches</td> <td>welches</td> </tr> <tr> <td>Plural <em>(die)</em></td> <td>welche</td> <td>welche</td> </tr> </tbody> </table> </div> </div>
<h2 dir="auto"> Pronouns: es </h2>*<div class="richtext-content-container"> <p><strong><em>es</em></strong><strong> used as a personal pronoun</strong></p> <p>The pronoun <em>es</em> is usually used to replace a neuter noun:</p> <p><em>Wo ist das Buch? – <strong>Es</strong> ist in der Tasche. </em><em>(<strong>es</strong> = das Buch)</em></p> <p> </p> <p><strong><em>es</em></strong><strong> as the formal subject with impersonal verbs</strong></p> <p>There are other functions that <em>es</em> can have. Sometimes <em>es</em> does not stand in for a definite noun but takes the role of the subject without having a meaning of its own. This construction is often used in impersonal phrases in which there is no other subject.</p> <p>Examples of this are sentences or clauses that describe weather phenomena:</p> <p><strong><em>Es</em></strong><em> regnet.</em><br/> <strong><em>Es</em></strong><em> schneit.</em><br/> <strong><em>Es</em></strong><em> ist sonnig.</em><br/> <strong><em>Es</em></strong><em> ist bewölkt.</em><br/> <strong><em>Es</em></strong><em> ist neblig.</em></p> <p>Here, <em>es</em> stands for a situation or state to which no concrete subject can be attributed.</p> </div>
