<h2 dir="auto"> Relative clauses: accusative </h2>*<div class="richtext-content-container"> <p><strong>Relative clauses with relative pronouns in the accusative </strong></p> <p>You have already learned that relative clauses give more detail about a noun or pronoun in a superordinate clause, the so-called antecedent. This antecedent defines the <em>Genus</em> (grammatical gender) and <em>Numerus</em> (singular/plural) of the relative pronoun which links the relative clause to the superordinate clause. The <em>Kasus</em> (case) of the relative pronoun depends on what grammatical function the relative pronoun has in the relative clause.</p> <p>In the nominative and accusative, the forms of the relative pronouns <em>der</em>, <em>die</em> and <em>das</em> look exactly the same as the definite articles:</p> <div class="tab-wrap"> <table> <tbody> <tr> <td>Gender/Number</td> <td>Case</td> <td> </td> </tr> <tr> <td> </td> <td>Nominative</td> <td>Accusative</td> </tr> <tr> <td>Masculine</td> <td>der</td> <td>den</td> </tr> <tr> <td>Feminine</td> <td>die</td> <td>die</td> </tr> <tr> <td>Neuter</td> <td>das</td> <td>das</td> </tr> <tr> <td>Plural</td> <td>die</td> <td>die</td> </tr> </tbody> </table> </div> <p> </p> <p><em>Ein Bäcker ist <strong>ein Mann</strong>. </em>(Nominative masculine singular)<br/> <strong><em>Er</em></strong><em> (= <strong>der Mann</strong>) muss sehr früh aufstehen.</em> (Subject: Nominative)<br/> <em>Ein Bäcker ist ein Mann, <strong>der</strong> sehr früh aufstehen muss.</em></p> <p> </p> <p><em>Ein Bäcker ist <strong>ein Mann</strong>.</em> (Nominative masculine singular)<br/> <em>Man sieht <strong>ihn</strong> (= <strong>den Mann</strong>) morgens in der Bäckerei.</em> (Accusative object)<br/> <em>Ein Bäcker ist ein Mann, <strong>den</strong> man morgens in der Bäckerei sieht.</em></p> <p> </p> <div class="tab-wrap"> <table> <tbody> <tr> <td> <p>Grammatical terms in German:</p> <p>der Genus: This is the grammatical gender of a noun. The gender can be seen from the definite article of the noun.</p> <p>der Numerus: The number of a word refers to whether it is singular or plural.</p> <p>der Kasus: This is the case of a noun with its accompanying words, e.g the nominative, the accusative or the dative.</p> </td> </tr> </tbody> </table> </div> </div>
<h2 dir="auto"> Linked relative clauses </h2>*<div class="richtext-content-container"> <p>You can link two relative clauses that relate to the same noun or pronoun.</p> <p>The relative pronouns can be different:<br/> <em>Das ist unser Schokoladenkuchen.</em><br/> <strong><em>Er </em></strong><em>ist sehr lecker.</em> (subject: nominative)<br/> <em>Wir empfehlen <strong>ihn</strong> unseren Gästen sehr.</em> (accusative object)</p> <p>Relative clause:<br/> <em>Das ist unser Schokoladenkuchen, <strong>der</strong> sehr lecker ist und <strong>den</strong> wir unseren Gästen sehr empfehlen.</em></p> <p> </p> <p>If the relative pronouns are the same, the second relative pronoun can be left out:<br/> <em>Ein Bäcker ist ein Mann.</em><br/> <strong><em>Er</em></strong><em> arbeitet nachts. </em>(subject: nominative)<br/> <strong><em>Er</em></strong><em> schläft am Tag. </em>(subject: nominative)<br/> <em>Ein Bäcker ist ein Mann, <strong>der</strong> nachts arbeitet und <strong>(der)</strong> am Tag schläft.</em></p> <p> </p> <p>Like the relative pronoun, the subject can also be left out, if it is identical in both clauses.</p> <p><em>Das ist unser Apfelkuchen.<br/> Wir backen <strong>ihn</strong> frisch. </em>(accusative object)<br/> <em>Wir servieren <strong>ihn</strong> warm. </em>(accusative object)<br/> <em>Das ist unser Apfelkuchen, <strong>den</strong> wir frisch backen und (<strong>den</strong> wir) warm servieren.</em></p> </div>
<h2 dir="auto"> Conjunctions: oder </h2>*<div class="richtext-content-container"> <p><strong>Connecting main clauses with </strong><strong><em>oder</em></strong></p> <p>The conjunction <em>oder</em> can link two main clauses together:</p> <p><em>Nehmen Sie das Zimmer für eine Nacht? Bleiben Sie länger?<br/> Nehmen Sie das Zimmer für eine Nacht <strong>oder</strong> bleiben Sie länger?</em></p> <p>When we use <em>oder</em> to link two clauses, we are describing two different possibilities. These are usually (but not always) mutually exclusive. The word order is unchanged.</p> <p>If the subject and the conjugated verb in both main clauses are the same, they can be omitted from the second clause.</p> <p><em>Möchten Sie ein Einzelzimmer? Möchten Sie ein Doppelzimmer?<br/> Möchten Sie ein Einzelzimmer <strong>oder</strong> ein Doppelzimmer?</em></p> </div>
<h2 dir="auto"> Subordinate clauses: weil </h2>*<div class="richtext-content-container"> <p> <picture> <source media="(min-width: 1024px)" srcset="/image/38303401_507.jpg"> <source media="(min-width: 768px)" srcset="/image/38303401_505.jpg"> <source media="(min-width: 480px)" srcset="/image/38303401_503.jpg"> <img alt="Deutschkurse | Nicos Weg | Grammatik_A2_E00_L2_S3_Foto1" class="img-responsive" src="/image/38303401_507.jpg"/> </source></source></source></picture></p> <p>A <strong>main clause</strong> generally consists of at least a subject and a conjugated verb. It is complete both grammatically and in terms of content and is thus self-contained.</p> <p>A <strong>subordinate clause</strong> cannot normally stand alone. It is dependent on a superordinate main clause or subordinate clause. There is a comma between the superordinate main clause and the subordinate clause. The conjugated verb is usually right at the end of a subordinate clause. Many subordinate clauses are connected to the superordinate clause by certain introductory words. One of these introductory words is the conjunction <em>weil</em>. A subordinate clause beginning with <em>weil</em> answers the question "why?". The interrogatives <em>warum</em>, <em>wieso</em> or <em>weshalb</em> are used to inquire as to a reason.</p> <p> </p> <p> </p> <div class="tab-wrap"> <table> <tbody> <tr> <td> <p>Grammatical terms in German:</p> <p>der Hauptsatz: A main clause generally consists of a subject and a conjugated verb. It is a self-contained sentence which may stand alone. In a simple statement sentence the verb is the second idea.</p> der Nebensatz: A subordinate clause cannot normally stand alone. It is dependent on a superordinate main clause or another subordinate clause. The conjugated verb is normally right at the end of a subordinate clause. Many subordinate clauses are linked to the superordinate clause by certain introductory words.</td> </tr> </tbody> </table> </div> </div>
<h2 dir="auto"> Multi-part predicates </h2>*<div class="richtext-content-container"> <p>When a statement has more than one verb or several verb parts, the following rules apply:</p> <ul> <li>A verb or verb part comes in second position and is conjugated.</li> <li>The other verbs or verb parts come at the end of the sentence. Their form is not adapted to the subject, but always stays the same.</li> </ul> <p>Examples of this sentence structure are sentences with modal verbs and sentences with separable verbs.</p> <p> </p> <div class="tab-wrap"> <table> <tbody> <tr> <td>Ich <strong><em>muss</em></strong></td> <td>morgen</td> <td><em><strong>arbeiten.</strong></em></td> </tr> <tr> <td>Du <strong><em>musst</em></strong></td> <td>morgen</td> <td><em><strong>arbeiten.</strong></em></td> </tr> <tr> <td>Ich <strong><em>stehe</em></strong></td> <td>jetzt</td> <td><em><strong>auf.</strong></em></td> </tr> <tr> <td>Er <strong><em>steht</em></strong></td> <td>jetzt</td> <td><em><strong>auf.</strong></em></td> </tr> <tr> <td>Ich <strong><em>muss</em></strong></td> <td>jetzt</td> <td><strong><em>aufstehen.</em></strong></td> </tr> <tr> <td>Ihr <strong><em>müsst</em></strong></td> <td>jetzt</td> <td><strong><em>aufstehen.</em></strong></td> </tr> </tbody> </table> </div> <p> </p> <p>The position of sentence parts can of course be changed. However, the position of the conjugated verb and other verbs does not change:</p> <p><em>Morgen <strong>muss</strong> ich <strong>arbeiten</strong>.<br/> Jetzt <strong>stehe</strong> ich <strong>auf</strong>.<br/> Jetzt <strong>muss</strong> ich <strong>aufstehen</strong>.</em></p> </div>
<h2 dir="auto"> Conjunctions: aber </h2>*<div class="richtext-content-container"> <p><strong>Main clauses linked with </strong><strong><em>aber</em></strong></p> <p>The conjunction <em>aber</em> can link two main clauses to each other:</p> <p><em>Zuerst wollte ich fliegen. Der Flug ist ausgefallen.<br/> Zuerst wollte ich fliegen, </em><strong>aber</strong><em> der Flug ist ausgefallen.</em></p> <p>If two clauses are linked with <em>aber</em>, the second clause limits the first or describes the contrary. The word order is unchanged.</p> <p>If the subject and conjugated verb are the same in both clauses, they can be omitted from the second clause.</p> <p><em>Ich habe ein Auto. Ich habe kein Fahrrad.<br/> Ich habe ein Auto, <strong>aber</strong> (ich habe) kein Fahrrad.</em></p> <p> </p> <div class="tab-wrap"> <table> <tbody> <tr> <td> <p>Grammatical terms in German:</p> <p>die Konjunktion: Conjunctions link sentences or clauses together. There are two types of conjunction:</p> <p>1. Conjunctions linking two sentences or clauses of equal ordination, e.g., <em>und</em>, <em>oder</em>, <em>aber</em>. These are also called coordinating conjunctions.</p> <p><span style="background-color:transparent">2. Conjunctions linking subordinate clauses to superordinate clauses, e.g., </span><em>weil</em><span style="background-color:transparent">, </span><em>dass</em><span style="background-color:transparent">. These are also called subordinating conjunctions.</span></p> </td> </tr> </tbody> </table> </div> </div>
<h2 dir="auto"> Questions and statements </h2>*<div class="richtext-content-container"> <p><em>Woher kommst du? – Ich komme aus Spanien.</em></p> <p><em>Kommst du aus Italien? – Nein, ich komme aus Spanien.</em></p> <p> </p> <p><strong>W-questions</strong></p> <p>W-questions are asked when specific information is requested. These questions cannot be answered with a simple "yes" or "no". The W-questions are so-called because the first word in the question usually begins with the letter <em>W</em>, e.g., <em>Woher …? Wo …? Wie …?</em> This is followed by the conjugated verb and the subject.</p> <p> <picture> <source media="(min-width: 1024px)" srcset="/image/38290117_507.jpg"> <source media="(min-width: 768px)" srcset="/image/38290117_505.jpg"> <source media="(min-width: 480px)" srcset="/image/38290117_503.jpg"> <img alt="Deutschkurse | Nicos Weg | Grammatik_A1_E4_L2_S1_Foto1" class="img-responsive" src="/image/38290117_507.jpg"/> </source></source></source></picture></p> <p><strong>Statements</strong></p> <p>In a simple statement, the conjugated verb is always in second position. The subject is often in first position.</p> <p> <picture> <source media="(min-width: 1024px)" srcset="/image/38290105_507.jpg"> <source media="(min-width: 768px)" srcset="/image/38290105_505.jpg"> <source media="(min-width: 480px)" srcset="/image/38290105_503.jpg"> <img alt="Deutschkurse | Nicos Weg | Grammatik_A1_E4_L2_S1_Foto2" class="img-responsive" src="/image/38290105_507.jpg"/> </source></source></source></picture></p> <p><strong>Yes-no questions</strong></p> <p>These are so-called because they can be answered with a simple "yes" or "no". Here the conjugated verb comes first. It is followed by the subject.</p> <p> <picture> <source media="(min-width: 1024px)" srcset="/image/38290171_507.jpg"> <source media="(min-width: 768px)" srcset="/image/38290171_505.jpg"> <source media="(min-width: 480px)" srcset="/image/38290171_503.jpg"> <img alt="Deutschkurse | Nicos Weg | Grammatik_A1_E4_L2_S1_Foto3" class="img-responsive" src="/image/38290171_507.jpg"/> </source></source></source></picture></p> <p>This means that a yes-no question can be formed by switching the positions of the subject and the conjugated verb in a statement.</p> <p> <picture> <source media="(min-width: 1024px)" srcset="/image/38290139_507.jpg"> <source media="(min-width: 768px)" srcset="/image/38290139_505.jpg"> <source media="(min-width: 480px)" srcset="/image/38290139_503.jpg"> <img alt="Deutschkurse | Nicos Weg | Grammatik_A1_E4_L2_S1_Foto4" class="img-responsive" src="/image/38290139_507.jpg"/> </source></source></source></picture></p> <p> <picture> <source media="(min-width: 1024px)" srcset="/image/38290183_507.jpg"> <source media="(min-width: 768px)" srcset="/image/38290183_505.jpg"> <source media="(min-width: 480px)" srcset="/image/38290183_503.jpg"> <img alt="Deutschkurse | Nicos Weg | Grammatik_A1_E4_L2_S1_Foto5" class="img-responsive" src="/image/38290183_507.jpg"/> </source></source></source></picture></p> <div class="tab-wrap"> <table> <tbody> <tr> <td> <p>Grammatical terms in German:</p> <p>das Subjekt: The subject is the person or thing that is active or central in the sentence. The subject is also known as "der Satzgegenstand". It is usually a noun or pronoun.</p> <p>die W-Frage: W-questions are open questions that cannot be answered with "yes" or "no". At the beginning of a W-question, there is a question word that usually begins with the letter <em>W</em>.</p> <p>der Aussagesatz: In a statement, a fact is declared. The statement may give information or describe a situation.</p> die Satzfrage<span id="ck_editor_caret_marker" style="display:none"></span>: This is a question that can be answered with "yes" or "no".</td> </tr> </tbody> </table> </div> </div>
<h2 dir="auto"> Relative clauses: nominative </h2>*<div class="richtext-content-container"> <p><strong>Relative clauses </strong></p> <p>Relative clauses are subordinate clauses. Generally they cannot stand alone and are dependent upon a superordinate main clause or subordinate clause. Relative clauses give more precise information about a noun or pronoun in the superordinate clause. Relative clauses generally come immediately after the word to which they relate (the antecedent). The conjugated verb is usually at the end of the relative clause. The relative clause is linked to the superordinate clause by a relative pronoun. This relative pronoun refers to the antecedent word in the superordinate clause.</p> <p><strong>Relative pronouns </strong></p> <p>The forms of the relative pronoun <em>der</em>, <em>die</em> and <em>das</em> usually correspond to the definite article. In the forms <em>der</em>, <em>die</em> and <em>das,</em> the relative pronouns introduce relative clauses in the nominative. The antecedent in the main clause defines the grammatical gender and number (singular or plural) of the pronoun. The case is defined by the role of the relative pronoun in the subordinate clause. If the relative pronoun in the subordinate clause has the function of a subject, it is in the nominative.</p> <p>Nominative masculine singular (<strong><em>der</em></strong><em> Mann</em>):</p> <p>Main clause + main clause:       <br/> <em>Der Koch ist <strong>der Mann</strong>. <strong>Er</strong> (= <strong>der Mann</strong>) kocht im Restaurant für Gäste. </em></p> <p>Main clause + relative clause:<br/> <em>Der Koch ist der Mann, <strong>der</strong> im Restaurant für Gäste kocht.</em></p> <p>Nominative feminine singular (<strong><em>die</em></strong><em> Kneipe</em>):</p> <p><em>Ich gehe gern in <strong>die Kneipe</strong>. <strong>Sie </strong>ist neben meinem Haus.<br/> Ich gehe gern in die Kneipe, <strong>die</strong> neben meinem Haus ist.</em></p> <p>In these examples, the antecedent has a definite article (<em>der</em>, <em>die</em>). But even if the antecedent has an indefinite article or no article at all, the relative pronoun in the nominative takes the form of the definite article.</p> <p>Nominative neuter singular (<strong><em>das</em></strong><em> Gericht</em>):</p> <p><em>Pizza ist <strong>ein Gericht</strong>. <strong>Es</strong> ist nicht besonders gesund.<br/> Pizza ist ein Gericht, <strong>das</strong> nicht besonders gesund ist.</em></p> <p>Nominative plural (<strong><em>die</em></strong><em> Menschen</em>):</p> <p><em>Feinschmecker sind <strong>Menschen</strong>. <strong>Sie</strong> wissen viel über gutes Essen.<br/> Feinschmecker sind Menschen, <strong>die</strong> viel über gutes Essen wissen.</em></p> <p> </p> <div class="tab-wrap"> <table> <tbody> <tr> <td> <p>Grammatical terms in German:</p> <p>der Relativsatz: a relative clause is a subordinate clause that gives more detailed information about a noun or pronoun in the superordinate clause.</p> das Relativpronomen: a relative pronoun links a relative clause to the superordinate clause.</td> </tr> </tbody> </table> </div> </div>
<h2 dir="auto"> Question Words: wer, was </h2>*<div class="richtext-content-container"> <p>When asking about <strong>people</strong> you use the question word <strong><em>wer</em></strong>.</p> <p> <picture> <source media="(min-width: 1024px)" srcset="/image/38289670_507.jpg"> <source media="(min-width: 768px)" srcset="/image/38289670_505.jpg"> <source media="(min-width: 480px)" srcset="/image/38289670_503.jpg"> <img alt="Deutschkurse | Nicos Weg | Grammatik_A1_E3_L2_S2_Foto1" class="img-responsive" src="/image/38289670_507.jpg"/> </source></source></source></picture></p> <p>When <strong>not</strong> asking about <strong>people, </strong>you use the question word <strong><em>was</em></strong>.</p> <p> <picture> <source media="(min-width: 1024px)" srcset="/image/38289645_507.jpg"> <source media="(min-width: 768px)" srcset="/image/38289645_505.jpg"> <source media="(min-width: 480px)" srcset="/image/38289645_503.jpg"> <img alt="Deutschkurse | Nicos Weg | Grammatik_A1_E3_L2_S2_Foto2" class="img-responsive" src="/image/38289645_507.jpg"/> </source></source></source></picture></p> </div>
<h2 dir="auto"> Final clauses: damit </h2>*<div class="richtext-content-container"> <p><strong>Final clauses introduced with </strong><strong><em>damit </em></strong></p> <p>Final clauses are dependent on a superordinate clause in which an action or process is usually being described.</p> <p>Action: <em>Wir kaufen einen Saugroboter.</em><br/> <br/> The final relative clause states the purpose or goal of the action or thing being described. It is introduced with the word <em>damit</em> and separated from the superordinate clause with a comma. The verb in the final relative clause is conjugated and comes at the end of the sentence.</p> <p><em>Wir kaufen einen Saugroboter, <strong>damit die Wohnung schneller sauber wird</strong>.</em></p> <p> </p> <div class="tab-wrap"> <table> <tbody> <tr> <td> <p>Grammatical terms in German:</p> <p>die Konjunktion: Conjunctions connect sentences or parts of sentences to each other. There is a distinction between two types of conjunction:</p> <p>1. Conjunctions that connect clauses of equal status, e.g., <em>und</em>, <em>oder</em>, <em>aber</em>. These are called coordinating conjunctions.</p> 2. Conjunctions that connect subordinate and superordinate clauses, e.g., <em>weil</em>, <em>dass</em>. These are called subordinating conjunctions.</td> </tr> </tbody> </table> </div> </div>
<h2 dir="auto"> Final clauses: um ... zu </h2>*<div class="richtext-content-container"> <p><strong>Final clauses introduced with </strong><strong><em>um ... zu</em></strong></p> <p>Final clauses are dependent on a superordinate clause which usually describe an action.</p> <p>Action: <em>Wir kaufen einen Saugroboter.</em></p> <p>The final clause states the purpose or goal of the action or thing being described. It is separated from the superordinate clause by a comma.</p> <p><em>Wir kaufen einen Saugroboter, <strong>um Zeit zu sparen</strong>.</em><br/> <br/> A final subordinate clause with <em>um … zu</em> is introduced with the conjunction <em>um</em>. The verb of the final clause comes at the end of the sentence. We use the infinitive form of the verb (+ <em>zu</em>). The verb is not conjugated. If the verb is separable, <em>zu</em> is added after the verb prefix.</p> <p><em>Ich brauche eine große Tasche, <strong>um die leeren Flaschen weg</strong>zu<strong>bringen</strong>.</em><br/> <br/> The final clause with <em>um … zu</em> does not have its own subject. Therefore, this sentence structure is only possible if the subject is the superordinate clause and the final clause is the same.</p> <p><strong><em>Ich</em></strong><em> hole einen Besen. <strong>Ich </strong>kehre die Terrasse.</em></p> <p><strong><em>Ich </em></strong><em>hole einen Besen, um die Terrasse zu kehren.</em></p> <p>If the subject is not identical, you can use a final subordinate clause introduced with the conjunction <em>damit</em>.</p> <p> </p> <div class="tab-wrap"> <table> <tbody> <tr> <td> <p>Grammatical terms in German:</p> der Infinitiv: The infinitive is the basic form of a verb that is not conjugated. This is the verb form normally found in vocabulary lists or dictionaries. German verbs in the infinitive generally end in <em>-(e)n</em>.</td> </tr> </tbody> </table> </div> <p> </p> </div>
<h2 dir="auto"> Sentence construction: subordinate clauses (1) </h2>*<div class="richtext-content-container"> <p>Subordinate clauses have the following features:</p> <ul> <li>They cannot normally stand alone but are linked to a superordinate clause.</li> <li>There is a comma between the main and subordinate clauses.</li> <li>Subordinate clauses usually begin with an introductory word, e.g. a conjunction or an interrogative.</li> <li>The conjugated verb in a subordinate clause is usually right at the end. There are only a few exceptions.</li> </ul> <p>The conjugated verb thus "migrates" to the end of the subordinate clause:</p> <p> <picture> <source media="(min-width: 1024px)" srcset="/image/38303389_507.jpg"> <source media="(min-width: 768px)" srcset="/image/38303389_505.jpg"> <source media="(min-width: 480px)" srcset="/image/38303389_503.jpg"> <img alt="Deutschkurse | Nicos Weg | Grammatik_A2_E00_L4_S2_Foto1" class="img-responsive" src="/image/38303389_507.jpg"/> </source></source></source></picture></p> <p> </p> <p>You have already encountered three types of subordinate clause in this unit:</p> <p>Causal clauses with <em>weil</em>:<br/> <em>Nico hat Yara gesucht, weil er ihre Hilfe <strong>braucht</strong>.</em></p> <p>Subordinate clauses with <em>dass</em>:<br/> <em>Nico sagt, dass er jeden Tag Deutsch <strong>lernt</strong>.</em></p> <p>Indirect interrogative clauses:<br/> <em>Yara will wissen, wo Nico jetzt <strong>wohnt</strong>.</em></p> </div>
<h2 dir="auto"> Sentence construction: Statements </h2>*<div class="richtext-content-container"> <p>In a simple statement the conjugated verb has a fixed position. It is always in second position. The position of the subject is freer. It often comes at the beginning of the sentence, before the conjugated verb.</p> <p>However, other parts of the sentence can also come at the beginning, in order to stress them. These are often details about time or place. Then the subject comes after the conjugated verb, i.e. in third position.</p> <p>Example: Time detail: <em>jetzt</em></p> <p> </p> <p> <picture> <source media="(min-width: 1024px)" srcset="/image/38290153_507.jpg"> <source media="(min-width: 768px)" srcset="/image/38290153_505.jpg"> <source media="(min-width: 480px)" srcset="/image/38290153_503.jpg"> <img alt="Deutschkurse | Nicos Weg | Grammatik_A1_E4_L3_S2_Foto1" class="img-responsive" src="/image/38290153_507.jpg"/> </source></source></source></picture></p> <p> </p> <p>Example: Place detail: <em>in Frankreich</em>*</p> <p> </p> <p> <picture> <source media="(min-width: 1024px)" srcset="/image/38290217_507.jpg"> <source media="(min-width: 768px)" srcset="/image/38290217_505.jpg"> <source media="(min-width: 480px)" srcset="/image/38290217_503.jpg"> <img alt="Deutschkurse | Nicos Weg | Grammatik_A1_E4_L3_S2_Foto2" class="img-responsive" src="/image/38290217_507.jpg"/> </source></source></source></picture></p> <p> </p> <p>*In this case the place detail consists of two words. Since these two words belong together they stand together in first position. The verb comes in second position here too.</p> <p> </p> <p>Sometimes other sentence parts also come in first position.</p> <p> </p> <p> <picture> <source media="(min-width: 1024px)" srcset="/image/38290196_507.jpg"> <source media="(min-width: 768px)" srcset="/image/38290196_505.jpg"> <source media="(min-width: 480px)" srcset="/image/38290196_503.jpg"> <img alt="Deutschkurse | Nicos Weg | Grammatik_A1_E4_L3_S2_Foto3" class="img-responsive" src="/image/38290196_507.jpg"/> </source></source></source></picture></p> </div>
