<h2 dir="auto"> Conjugation: haben </h2>*<div class="richtext-content-container"> <p><em>Welche Nummer <strong>hast</strong> du? – Ich <strong>habe</strong> die Nummer vier, eins, acht, sieben.</em></p> <p> <picture> <source media="(min-width: 1024px)" srcset="/image/37494377_507.jpg"> <source media="(min-width: 768px)" srcset="/image/37494377_505.jpg"> <source media="(min-width: 480px)" srcset="/image/37494377_503.jpg"> <img alt="Deutschkurse | Nicos Weg | A1_E2_L4_Wartemarke_4187_23698686" class="img-responsive" src="/image/37494377_507.jpg"/> </source></source></source></picture></p> <p><strong>Conjugation of the verb <em>haben</em></strong></p> <p>The verb <em>haben</em> is irregular in the second- and third-person singular: the <em>b</em> is omitted.</p> <div class="tab-wrap"> <table> <tbody> <tr> <td><em>Singular</em></td> <td> </td> </tr> <tr> <td>1st person</td> <td>ich habe</td> </tr> <tr> <td>2nd person</td> <td>du <strong>hast</strong></td> </tr> <tr> <td>3rd person</td> <td>er/sie/es <strong>hat</strong></td> </tr> <tr> <td><em>Plural</em></td> <td> </td> </tr> <tr> <td>1st person</td> <td>wir haben</td> </tr> <tr> <td>2nd person</td> <td>ihr habt</td> </tr> <tr> <td>3rd person</td> <td>sie haben</td> </tr> <tr> <td><em>Formal:</em></td> <td>Sie haben</td> </tr> </tbody> </table> </div> <p> </p> <p> </p> <p> </p> </div>
<h2 dir="auto"> Conjugation: mögen </h2>*<div class="richtext-content-container"> <p><strong>Magst</strong> du Kohlrabi? – Nein, ich <strong>mag</strong> <em>keinen Kohlrabi</em><strong>.</strong></p> <p>The verb <em>mögen</em> belongs to the group of modal verbs. Unlike other verbs, it is not generally combined with a second verb in the infinitive, but rather takes an accusative object.</p> <p>Just as with the modal verbs <em>können</em>, <em>müssen</em> and <em>wollen,</em> the root vowel changes in the singular.</p> <p> </p> <div class="tab-wrap"> <table> <tbody> <tr> <td><em>Singular</em></td> <td> </td> </tr> <tr> <td>1st person</td> <td>ich m<strong>a</strong>g</td> </tr> <tr> <td>2nd person</td> <td>du  m<strong>a</strong>gst</td> </tr> <tr> <td>3rd person</td> <td>er/sie/es m<strong>a</strong>g</td> </tr> <tr> <td><em>Plural</em></td> <td> </td> </tr> <tr> <td>1st person</td> <td>wir mögen</td> </tr> <tr> <td>2nd person</td> <td>ihr mögt</td> </tr> <tr> <td>3rd person</td> <td>sie mögen</td> </tr> <tr> <td><em>Formal</em></td> <td>Sie mögen</td> </tr> </tbody> </table> </div> </div>
<h2 dir="auto"> Separable verbs </h2>*<div class="richtext-content-container"> <p><strong>Summary: separable verbs</strong></p> <p>In German you can add a prefix to a simple verb, forming a verb with a new meaning.</p> <p><em>Prefix + verb = <strong>new verb</strong><br/> ab + fahren = <strong>abfahren</strong><br/> zurück + fahren =<strong> zurückfahren</strong></em></p> <p>Many of these new verbs are separable. This means that for a simple declarative sentence in the present, the original simple verb is conjugated and is the second idea in the sentence. The prefix is at the end of the sentence.</p> <p><strong><em>ab|fahren:</em></strong><br/> <em>Der Zug <strong>fährt</strong> um 9:45 Uhr <strong>ab</strong>.</em></p> <p> </p> <p>In combination with a modal verb, the separable verb is at the end of the sentence in the infinitive. In this case, the prefix is not separated.</p> <p><strong><em>um|steigen:</em></strong><br/> <em>Du <strong>musst</strong> nicht <strong>umsteigen</strong>.</em></p> <p> </p> <p>In the present perfect, a past participle is formed from the separable verb by placing <em>-ge-</em> between the prefix and the verb stem.</p> <p><strong><em>weg|fahren:</em></strong><br/> <em>Ich bin schon seit einigen Jahren nicht mehr <strong>weg</strong>ge<strong>fahren</strong>.</em></p> <p> </p> <p>You can often tell whether a verb is separable from its prefix.</p> <ul> <li>Verbs with the prefixes e.g. <em>ab-, an-, auf-, aus-, ein-, mit-, nach-, weg-, zu- </em>are always separable.</li> <li>By contrast, verbs with the prefixes <em>be-, ent-, er-, ver-, zer-</em> <strong>are not</strong> separable.</li> <li>Verbs with the prefixes <em>durch-, über-, um-, unter- </em>can be separable or inseparable.</li> </ul> <p> </p> <p>You can also recognize separable verbs by their pronunciation. With separable verbs, the prefix is always stressed.</p> <p><strong><em>auf</em></strong>stehen: separable</p> <p>ver<strong><em>steh</em></strong>en: not separable</p> <p> </p> <div class="tab-wrap"> <table> <tbody> <tr> <td> <p>Grammatical terms in German:</p> Das trennbare Verb: Separable verbs have a prefix that can be separated and then comes at the end of the sentence.</td> </tr> </tbody> </table> </div> <p> </p> </div>
<h2 dir="auto"> Simple past: mixed verbs </h2>*<div class="richtext-content-container"> <p>A few verbs have characteristics of irregular and regular verbs: their ending (<em>-te- </em>+ personal ending) is regular but they have a vowel change. We call these "mixed verbs".</p> <p>The mixed verbs include, for example, <em>wissen</em>, <em>bringen, denken</em> and <em>kennen</em>.</p> <div class="tab-wrap"> <table> <tbody> <tr> <td>Infinitive</td> <td>Simple past</td> <td>Past Participle</td> </tr> <tr> <td>w<strong><em>i</em></strong>ssen</td> <td>w<strong><em>u</em></strong>ss<strong><em>te</em></strong></td> <td>gew<strong><em>u</em></strong>ss<strong><em>t</em></strong></td> </tr> <tr> <td>br<strong><em>i</em></strong>ngen</td> <td>br<strong><em>a</em></strong><em>ch<strong>te</strong></em></td> <td>gebr<strong><em>a</em></strong>ch<strong><em>t</em></strong></td> </tr> <tr> <td>d<strong><em>e</em></strong>nken</td> <td>d<strong><em>a</em></strong><em>ch<strong>te</strong></em></td> <td>ged<strong><em>a</em></strong><em>ch<strong>t</strong></em></td> </tr> <tr> <td>k<strong><em>e</em></strong>nnen</td> <td>k<strong><em>a</em></strong>nn<strong><em>te</em></strong></td> <td>gek<strong><em>a</em></strong>nn<strong><em>t</em></strong></td> </tr> </tbody> </table> </div> <p> </p> </div>
<h2 dir="auto"> Passive (2) </h2>*<div class="richtext-content-container"> <p><strong>Present passive </strong></p> <p>To describe an action in the present using the passive, we combine the present form of the auxiliary verb <em>werden</em> with the past participle.</p> <p><em>Das Essen <strong>wird</strong> von den Kunden über eine App <strong>bestellt</strong>.</em></p> <p><em>Die Gerichte <strong>werden</strong> mit Yaras Fahrrädern <strong>ausgeliefert</strong>.</em><br/> <br/> The verb <em>werden</em> is irregular:</p> <div class="tab-wrap"> <table> <tbody> <tr> <td><em>Singular</em></td> <td> </td> </tr> <tr> <td>1st person</td> <td>ich werde</td> </tr> <tr> <td>2nd person</td> <td>du <strong><em>wirst</em></strong></td> </tr> <tr> <td>3rd person</td> <td>er/sie/es <strong><em>wird</em></strong></td> </tr> <tr> <td><em>Plural</em></td> <td> </td> </tr> <tr> <td>1st person</td> <td>wir werden</td> </tr> <tr> <td>2nd person</td> <td>ihr werdet</td> </tr> <tr> <td>3rd person</td> <td>sie werden</td> </tr> <tr> <td><em>Formal</em></td> <td>Sie werden</td> </tr> </tbody> </table> </div> <p> </p> <p><strong>Simple past passive </strong></p> <p>When the passive is used to describe an action that occurred in the past, we can use the simple past. The simple past passive is formed using the auxiliary verb <em>werden</em> in the simple past and the past participle.</p> <p><em>Das Restaurant „Hiltl“ <strong>wurde</strong> 1907 von Ambrosius Hiltl <strong>gekauft</strong>.</em></p> <p><em>Vegetarische Gerichte <strong>wurden</strong> im Restaurant „Hiltl“ schon im Jahr 1898 <strong>angeboten</strong>.</em><br/> <br/> In the simple past, the verb <em>werden</em> is conjugated as follows:</p> <div class="tab-wrap"> <table> <tbody> <tr> <td><em>Singular</em></td> <td> </td> </tr> <tr> <td>1st person</td> <td>ich wurde</td> </tr> <tr> <td>2nd person</td> <td>du wurdest</td> </tr> <tr> <td>3rd person</td> <td>er/sie/es wurde</td> </tr> <tr> <td><em>Plural</em></td> <td> </td> </tr> <tr> <td>1st person</td> <td>wir wurden</td> </tr> <tr> <td>2nd person</td> <td>ihr wurdet</td> </tr> <tr> <td>3rd person</td> <td>sie wurden</td> </tr> <tr> <td><em>Formal</em></td> <td>Sie wurden</td> </tr> </tbody> </table> </div> <p> </p> </div>
<h2 dir="auto"> Modal verbs: the meaning </h2>*<div class="richtext-content-container"> <p>So far you know three modal verbs<em>: können, müssen </em>and<em> wollen:</em></p> <p>The modal verb <strong><em>können</em></strong> expresses an ability or possibility:<br/> <em>Nico <strong>kann</strong> studieren.</em> (He has the mental ability and the financial means to study.)<br/> In the singular, the vowel <em>ö</em> changes to <em>a</em>.</p> <p>The modal verb <strong><em>müssen</em></strong> expresses a necessity or compulsion:<br/> <em>Nico <strong>muss</strong> studieren.</em> (His parents are putting pressure on him. If he does not study this will have negative consequences for him.)<br/> In the singular the vowel <em>ü</em> changes to <em>u</em>.</p> <p>The modal verb <strong><em>wollen</em></strong> expresses a desire or intention:<br/> <em>Nico <strong>will</strong> studieren.</em> (He wishes or plans to study.)<br/> In the singular the vowel <em>o</em> changes to <em>i</em>.</p> <p>There is one more modal verb that is used to express wishes, <strong>möchten</strong> <strong>(mögen)</strong>: <br/> <em>Nico <strong>möchte</strong> studieren.</em></p> <p>The modal verbs <em>wollen</em> and <em>möchten</em> are similar in meaning. Both describe something that one would like to have or do, but with a different emphasis.</p> <ul> <li><em>Ich möchte …</em> describes a wish and sounds more polite.</li> <li><em>Ich will …</em> is stronger and more definite.</li> </ul> <p>The verb <em>möchten</em> is conjugated differently from the other modal verbs. This is because <em>möchten</em> is a special form of the verb <em>mögen</em>. But here too, the first- and third-person singular are identical.</p> <div class="tab-wrap"> <table> <tbody> <tr> <td><em>Singular:</em></td> <td> </td> </tr> <tr> <td>1st person</td> <td>ich <em>möchte</em></td> </tr> <tr> <td>2nd person</td> <td>du möchtest</td> </tr> <tr> <td>3rd person</td> <td>er/sie/es <strong><em>möchte</em></strong></td> </tr> <tr> <td><em>Plural:</em></td> <td> </td> </tr> <tr> <td>1st person</td> <td>wir möchten</td> </tr> <tr> <td>2nd person</td> <td>ihr möchtet</td> </tr> <tr> <td>3rd person</td> <td>sie möchten</td> </tr> <tr> <td><em>Formal (singular and plural):</em></td> <td>Sie möchten</td> </tr> </tbody> </table> </div> </div>
<h2 dir="auto"> Present perfect with "sein" </h2>*<div class="richtext-content-container"> <p>The present perfect is usually made from the auxiliary verb <em>haben</em> and the past participle. However, certain verbs are not used with <em>haben</em>, but with <em>sein</em>.</p> <p><strong>Verbs that form the present perfect with <em>sein are</em>  …</strong></p> <p>... verbs that express movement in a particular direction or a change of location, e.g. <em>gehen</em>, <em>fahren</em>, <em>fliegen</em>, <em>schwimmen</em> and <em>reisen</em><em>.</em><br/> <strong>schwimmen</strong><em>: Wir <strong>sind</strong> im See <strong>geschwommen</strong>.</em></p> <p>... verbs that indicate a change of state or describe an event that one cannot control, e.g. <em>einschlafen</em><em>,</em><em> aufwachen</em> and<em> passieren</em>.<br/> <strong>einschlafen</strong><em>: Ich <strong>bin</strong> am Samstag spät <strong>eingeschlafen</strong>. </em><br/> <strong>aufwachen</strong><em>: Am Sonntag <strong>bin</strong> ich erst um 11:00 Uhr <strong>aufgewacht</strong>.</em></p> <p>... the verbs <em>sein, bleiben</em> and <em>werden</em>.<br/> <strong>sein</strong><em>: Wir <strong>sind</strong> in der Nähe von Hamburg <strong>gewesen</strong>. </em>(But as you already know, the verb <em>sein</em> is normally used in the simple past if you want to express something that happened in the past.)<br/> <strong>bleiben</strong><em>: Wir <strong>sind</strong> drei Tage bei meinem Onkel <strong>geblieben</strong>.</em><br/> <strong>werden</strong><em>: Am Anfang war es sonnig, aber dann <strong>ist</strong> das Wetter immer schlechter <strong>geworden</strong>.</em></p> <p><strong>Verbs that form the present perfect with <em>haben</em> are …</strong></p> <p>... all other verbs (especially verbs that can have an accusative object, e.g. <em>machen)</em><br/> <strong>machen:</strong> <em>Wir <strong>haben</strong> </em>einen Spaziergang<em> <strong>gemacht</strong>.</em></p> </div>
<h2 dir="auto"> Conjugation: können </h2>*<div class="richtext-content-container"> <p><strong><em>Kannst</em></strong><em> du am Montag? – Nein, am Montag <strong>kann</strong> ich nicht.</em></p> <p>The verb <em>können</em> belongs to the special group of verbs known as "modal verbs". These verbs are conjugated differently from the verbs that you already know.:</p> <ul> <li>Modal verbs often have a different vowel in the singular than in the plural.</li> <li>The form of the first- and third-person singular is the same: the verb has no ending.</li> </ul> <div class="tab-wrap"> <table> <tbody> <tr> <td><em>Singular</em></td> <td> </td> </tr> <tr> <td>1st person</td> <td> ich <em>k<strong>a</strong>nn</em></td> </tr> <tr> <td>2nd person</td> <td> du <em>k<strong>a</strong>nnst</em></td> </tr> <tr> <td>3rd person</td> <td> er/sie/es <em>k<strong>a</strong>nn</em></td> </tr> <tr> <td><em>Plural</em></td> <td> </td> </tr> <tr> <td>1st person</td> <td> wir können</td> </tr> <tr> <td>2nd person</td> <td> ihr könnt</td> </tr> <tr> <td>3rd person</td> <td> sie können</td> </tr> <tr> <td><em>Formal</em></td> <td> Sie können</td> </tr> </tbody> </table> </div> </div>
<h2 dir="auto"> gehen + infinitive </h2>*<div class="richtext-content-container"> <p><strong><em>Gehst</em></strong><em> du gerne <strong>schwimmen</strong>? – Ja, ich <strong>gehe</strong> gerne <strong>schwimmen</strong>.</em></p> <p>If we want to express that we are leaving one place in order to do something in another place, then the word <em>gehen</em> is sometimes combined with a second verb. There are some established verb combinations that follow this pattern:</p> <p><em>arbeiten gehen<br/> einkaufen gehen<br/> spazieren gehen<br/> angeln gehen<br/> schwimmen gehen<br/> schlafen gehen</em></p> <p>In these expressions, the word <em>gehen</em> is conjugated. The second verb comes at the end of the sentence in the infinitive.</p> <div class="tab-wrap"> <table> <tbody> <tr> <td> <p>Ich</p> </td> <td> <p><strong><em>gehe</em></strong></p> </td> <td>morgen <strong><em>arbeiten.</em></strong></td> </tr> <tr> <td> <p>Inge</p> </td> <td> <p><strong><em>geht</em></strong></p> </td> <td>im Park <strong><em>spazieren.</em></strong></td> </tr> <tr> <td>Wir</td> <td><strong><em>gehen</em></strong></td> <td>gerne <strong><em>angeln.</em></strong></td> </tr> </tbody> </table> </div> </div>
<h2 dir="auto"> Past participle: irregular </h2>*<div class="richtext-content-container"> <p>Even in the past participle form, most irregular verbs begin with <em>ge-</em>. In many verbs, however, there is a stem change. The participle form of irregular verbs ends most often in <em>-en</em>.</p> <div class="tab-wrap"> <table> <tbody> <tr> <td>Infinitive</td> <td>Past participle</td> </tr> <tr> <td>f<strong>a</strong>hren</td> <td><em>ge-</em>f<strong>a</strong>hr<strong><em>-en</em></strong></td> </tr> <tr> <td>fl<strong>ie</strong>gen</td> <td><em>ge-</em>fl<strong>o</strong>g<strong><em>-en</em></strong></td> </tr> <tr> <td>s<strong>i</strong>ngen</td> <td><em>ge-</em>s<strong>u</strong>ng<strong><em>-en</em></strong></td> </tr> <tr> <td>bl<strong>ei</strong>ben</td> <td><em>ge-</em>bl<strong>ie</strong>b<strong><em>-en</em></strong></td> </tr> </tbody> </table> </div> <p> </p> <p>As you can see, there really are not any rules for if and how a vowel in the root will change in this tense, which is why you have to memorize irregular verbs.</p> <p> </p> <p>Verbs which do not have separable prefixes create the past participle without <em>ge-</em>:</p> <div class="tab-wrap"> <table> <tbody> <tr> <td>Infinitive</td> <td>Past participle</td> </tr> <tr> <td>beg<strong>i</strong>nnen</td> <td>beg<strong>o</strong>nn<strong><em>-en</em></strong></td> </tr> <tr> <td>verg<strong>e</strong>ssen</td> <td>verg<strong>e</strong>ss<strong><em>-en</em></strong></td> </tr> <tr> <td>verl<strong>ie</strong>ren</td> <td>verl<strong>o</strong>r<strong><em>-en</em></strong></td> </tr> </tbody> </table> </div> <p> </p> <p>There are a few irregular verbs in the past participle tense that evidence special characteristics. These forms will likewise need to be memorized.</p> <p>Here are a few examples:</p> <div class="tab-wrap"> <table> <tbody> <tr> <td>Infinitive</td> <td>Past participle</td> </tr> <tr> <td>essen</td> <td><em>ge-</em><strong>g</strong>ess<strong><em>-en</em></strong></td> </tr> <tr> <td>g<strong>eh</strong>en</td> <td><em>ge</em>-<strong>gang<em>-en</em></strong></td> </tr> <tr> <td>w<strong>i</strong>ssen</td> <td><em>ge-</em>w<strong>u</strong>ss<strong>-<em>t</em></strong></td> </tr> <tr> <td>verst<strong>eh</strong>en</td> <td>verst<strong>and<em>-en</em></strong></td> </tr> </tbody> </table> </div> <p> </p> <p> </p> <div class="tab-wrap"> <table> <tbody> <tr> <td> <p>Grammar concepts in German:</p> <p>regelmäßig: A grammatic form is regular when it is created following an established pattern that can be transferred to other words.</p> <p>unregelmäßig: Irregular forms are those which need to be memorized, as there is no set rule for how one goes from the base form of the verb to the new form. Irregular forms are those which contain special characteristics that do not follow the set rules. </p> </td> </tr> </tbody> </table> </div> <p> </p> <p> </p> </div>
<h2 dir="auto"> Vowel change: a to ä </h2>*<div class="richtext-content-container"> <p>You already know verbs with the vowel change <em>e</em> to <em>i</em>. Another group of irregular verbs has a vowel change from <em>a</em> to <em>ä</em>. Again, these irregularities only affect the second- and third-person singular present.</p> <p><em>Ich <strong>fahre</strong> nach Berlin. Und wohin <strong>fährst</strong> du, Lisa? – Ich <strong>fahre</strong> nach München.</em></p> <div class="tab-wrap"> <table> <tbody> <tr> <td><em>Singular:</em></td> <td> </td> </tr> <tr> <td>1st person</td> <td> ich fahre</td> </tr> <tr> <td>2nd person</td> <td> du <strong>fährst</strong></td> </tr> <tr> <td>3rd person</td> <td> er/sie/es <strong>fährt</strong></td> </tr> <tr> <td><em>Plural:</em></td> <td> </td> </tr> <tr> <td>1st person</td> <td> wir fahren</td> </tr> <tr> <td>2nd person</td> <td> ihr fahrt</td> </tr> <tr> <td>3rd person</td> <td> sie fahren</td> </tr> <tr> <td><em>Formal:</em></td> <td> Sie fahren</td> </tr> </tbody> </table> </div> <p><br/> The verbs <em>schlafen</em>, <em>waschen </em>and <em>anfangen </em>also have a vowel change from <em>a</em> to <em>ä</em>.</p> <p>The verb <em>anfangen</em> is a separable verb:</p> <p><em>Wann <strong>fängt </strong>der Film <strong>an</strong>? – Der Film <strong>fängt </strong>um 15:00 Uhr <strong>an</strong>. Die Kinderfilme <strong>fangen </strong>immer um 15:00 Uhr <strong>an</strong>.</em></p> </div>
<h2 dir="auto"> Past participles: regular </h2>*<div class="richtext-content-container"> <p>With regular verbs, the past participle usually begins with the prefix <em>ge-;</em> then comes the verb root, followed by a <em>-t </em>at the end.</p> <div class="tab-wrap"> <table> <tbody> <tr> <td>Infinitive</td> <td>Past participle</td> </tr> <tr> <td>machen </td> <td><strong>ge</strong>-mach<strong>-t</strong></td> </tr> <tr> <td>frühstücken </td> <td><strong>ge</strong>-frühstück-<strong>t</strong></td> </tr> <tr> <td>kochen</td> <td><strong>ge</strong>-koch<strong>-t</strong></td> </tr> </tbody> </table> </div> <p> </p> <p> </p> <p>If the verb root ends in <em>-t</em> or <em>-d</em>, an additional <em>e </em>is added. This extra <em>e</em> is also added after a cluster of consonants. Often, you will be able to identify when an <em>e</em> is necessary, as without it, the word would be hard to say.</p> <div class="tab-wrap"> <table> <tbody> <tr> <td>Infinitive</td> <td>Past participle</td> </tr> <tr> <td> <p>arbei<strong><em>t</em></strong>en</p> </td> <td> <p><strong>ge-</strong>arbeit<strong>-<em>e</em>t</strong></p> </td> </tr> <tr> <td>ö<strong><em>ffn</em></strong>en</td> <td><strong>ge-</strong>öffn<strong>-<em>e</em>t</strong></td> </tr> </tbody> </table> </div> <p> </p> <p>Some verbs make the past participle without <em>ge-</em>:</p> <ul> <li>Verbs which end in <em>-ieren</em></li> <li>Verbs with inseparable prefixes, i.e. <em>be-</em>, <em>ent-</em>, <em>er-</em>, <em>ver-</em>, <em>zer</em>-</li> </ul> <div class="tab-wrap"> <table> <tbody> <tr> <td>Infinitive </td> <td>Past participle </td> </tr> <tr> <td> <p>fotografieren</p> </td> <td> <p>fotografier<strong>-t</strong></p> </td> </tr> <tr> <td> <p>reservieren</p> </td> <td> <p>reservier<strong>-t</strong></p> </td> </tr> <tr> <td>besuchen</td> <td>besuch<strong>-t</strong></td> </tr> </tbody> </table> </div> <p> </p> <div class="tab-wrap"> <table> <tbody> <tr> <td> <p>Grammatical terms in German:</p> das Partizip II: The past participle is formed from a verb and resembles an adjective. It is used in a variety of grammatical structures, for example to form the present perfect tense.</td> </tr> </tbody> </table> </div> </div>
<h2 dir="auto"> Conjugation: present tense (1) </h2>*<div class="richtext-content-container"> <p>In conjugation, the endings of the verbs often change. The ending depends on which person is doing the action. The ending comes after the verb stem.</p> <p> <picture> <source media="(min-width: 1024px)" srcset="/image/37447655_507.jpg"> <source media="(min-width: 768px)" srcset="/image/37447655_505.jpg"> <source media="(min-width: 480px)" srcset="/image/37447655_503.jpg"> <img alt="Deutschkurse | Nicos Weg | Grammatik | Grammatik_A1_E1_S5_Foto1" class="img-responsive" src="/image/37447655_507.jpg"/> </source></source></source></picture></p> <p> </p> <p>Example: <em>kommen</em></p> <p><em>Woher komm<strong>st</strong> <strong>du</strong>, Nico? – <strong>Ich</strong> komm<strong>e</strong> aus Spanien.</em></p> <p><em>Woher komm<strong>en</strong> <strong>Sie</strong>, Herr González? – <strong>Ich</strong> komm<strong>e</strong> aus Spanien.</em></p> <p><br/> Most verbs are conjugated in the present tense as follows:</p> <div class="tab-wrap"> <table> <tbody> <tr> <td> </td> <td> </td> <td>kommen</td> </tr> <tr> <td>Singular</td> <td>1st person</td> <td><strong>ich</strong> komm<strong>e</strong></td> </tr> <tr> <td>Singular</td> <td>2nd person</td> <td><strong>du</strong> komm<strong>st</strong></td> </tr> <tr> <td>Singular and plural</td> <td>formal address</td> <td><strong>Sie</strong> komm<strong>en</strong></td> </tr> </tbody> </table> </div> <p> </p> <p>Example: <em>heißen</em></p> <p>When the verb stem ends in<em> -s, -ß, -z</em> or <em>-x</em> , the second-person singular form only adds a <strong>-t</strong> :</p> <div class="tab-wrap"> <table> <tbody> <tr> <td> </td> <td> </td> <td>heißen</td> </tr> <tr> <td>Singular</td> <td>1st person</td> <td><strong>ich </strong>heiß<strong>e</strong></td> </tr> <tr> <td>Singular</td> <td>2nd person</td> <td><strong>du</strong> heiß<strong>t</strong></td> </tr> <tr> <td>Singular and plural </td> <td>formal address</td> <td><strong>Sie </strong>heiß<strong>en</strong></td> </tr> </tbody> </table> </div> <p> </p> <p>Example: <em>sein</em></p> <p><strong><em>Ich</em></strong><em> <strong>bin</strong> Nico. Und wer <strong>bist du</strong>? – <strong>Ich</strong> <strong>bin</strong> Emma.</em></p> <p><strong><em>Ich bin</em></strong><em> Lisa Brunner. Und wer <strong>sind Sie</strong>? – <strong>Ich</strong> <strong>bin</strong> Sigi Körner.</em></p> <p>The verb <em>sein</em> and other important German verbs are irregular. So always learn the verb forms as well!</p> <div class="tab-wrap"> <table> <tbody> <tr> <td> </td> <td> </td> <td>sein</td> </tr> <tr> <td>Singular</td> <td>1st person</td> <td><strong>ich</strong> <strong>bin</strong></td> </tr> <tr> <td>Singular</td> <td>2nd person</td> <td><strong>du</strong> <strong>bist</strong></td> </tr> <tr> <td>Singular and plural</td> <td>formal address</td> <td><strong>Sie</strong> <strong>sind</strong></td> </tr> </tbody> </table> </div> <p> </p> <div class="tab-wrap"> <table> <tbody> <tr> <td> <p>Grammatical terms in German:</p> <p>das Verb: Verbs are words that describe activities, occurrences or a situation, e.g. walk, eat, play. German verbs usually end with <em>-en </em>in<em> </em>the infinitive, e.g.<em> kommen, heißen, lernen</em>.</p> <p>die Konjugation: When a verb is used in a different tense, or with a different person, it changes. It often gets a specific ending. This change in the verb form is known as conjugation.</p> das Präsens: The present is a verb tense. It is used when speaking about events, activities or situations that happen in the present or are continuing to happen.</td> </tr> </tbody> </table> </div> <div class="tab-wrap"> <table> <tbody> </tbody> </table> </div> <p> </p> </div>
