<h2 dir="auto"> Simple past: regular verbs (1) </h2>*<div class="richtext-content-container"> <p><strong>Regular verbs in the simple past</strong></p> <p>The simple past is the verb tense used when something happened in the past. It is mainly used in written language, for example, in newspapers or books.</p> <p>You already know the simple past of the auxiliary verbs <em>sein </em>and <em>haben,</em> and that of the modal verbs. Just like with modal verbs, regular verbs in the simple past are made by adding <em>-te-</em> to the root verb, followed by the ending that corresponds to the person doing the action. In the first- and third-person singular, however, there is no additional personal ending after the <em>-te</em>.</p> <p>An example of a regular verb is <em>machen</em>, which is conjugated like this:</p> <div class="tab-wrap"> <table> <tbody> <tr> <td> </td> <td>Present</td> <td>Simple past</td> </tr> <tr> <td><em>Singular</em></td> <td> </td> <td> </td> </tr> <tr> <td>1st person</td> <td>ich mache</td> <td>ich mach<strong>te</strong></td> </tr> <tr> <td>2nd person</td> <td>du machst</td> <td>ich mach<strong>te</strong>st</td> </tr> <tr> <td>3rd person</td> <td>er/sie/es macht</td> <td>er/sie/es mach<strong>te</strong></td> </tr> <tr> <td><em>Plural</em></td> <td> </td> <td> </td> </tr> <tr> <td>1st person</td> <td>wir machen</td> <td>wir mach<strong>te</strong>n</td> </tr> <tr> <td>2nd person</td> <td>ihr macht</td> <td>ihr mach<strong>te</strong>t</td> </tr> <tr> <td>3rd person</td> <td>sie machen</td> <td>sie mach<strong>te</strong>n</td> </tr> <tr> <td><em>Formal</em></td> <td>Sie machten</td> <td>Sie mach<strong>te</strong>n</td> </tr> </tbody> </table> </div> <p> </p> </div>
<h2 dir="auto"> Passive (2) </h2>*<div class="richtext-content-container"> <p><strong>Present passive </strong></p> <p>To describe an action in the present using the passive, we combine the present form of the auxiliary verb <em>werden</em> with the past participle.</p> <p><em>Das Essen <strong>wird</strong> von den Kunden über eine App <strong>bestellt</strong>.</em></p> <p><em>Die Gerichte <strong>werden</strong> mit Yaras Fahrrädern <strong>ausgeliefert</strong>.</em><br/> <br/> The verb <em>werden</em> is irregular:</p> <div class="tab-wrap"> <table> <tbody> <tr> <td><em>Singular</em></td> <td> </td> </tr> <tr> <td>1st person</td> <td>ich werde</td> </tr> <tr> <td>2nd person</td> <td>du <strong><em>wirst</em></strong></td> </tr> <tr> <td>3rd person</td> <td>er/sie/es <strong><em>wird</em></strong></td> </tr> <tr> <td><em>Plural</em></td> <td> </td> </tr> <tr> <td>1st person</td> <td>wir werden</td> </tr> <tr> <td>2nd person</td> <td>ihr werdet</td> </tr> <tr> <td>3rd person</td> <td>sie werden</td> </tr> <tr> <td><em>Formal</em></td> <td>Sie werden</td> </tr> </tbody> </table> </div> <p> </p> <p><strong>Simple past passive </strong></p> <p>When the passive is used to describe an action that occurred in the past, we can use the simple past. The simple past passive is formed using the auxiliary verb <em>werden</em> in the simple past and the past participle.</p> <p><em>Das Restaurant „Hiltl“ <strong>wurde</strong> 1907 von Ambrosius Hiltl <strong>gekauft</strong>.</em></p> <p><em>Vegetarische Gerichte <strong>wurden</strong> im Restaurant „Hiltl“ schon im Jahr 1898 <strong>angeboten</strong>.</em><br/> <br/> In the simple past, the verb <em>werden</em> is conjugated as follows:</p> <div class="tab-wrap"> <table> <tbody> <tr> <td><em>Singular</em></td> <td> </td> </tr> <tr> <td>1st person</td> <td>ich wurde</td> </tr> <tr> <td>2nd person</td> <td>du wurdest</td> </tr> <tr> <td>3rd person</td> <td>er/sie/es wurde</td> </tr> <tr> <td><em>Plural</em></td> <td> </td> </tr> <tr> <td>1st person</td> <td>wir wurden</td> </tr> <tr> <td>2nd person</td> <td>ihr wurdet</td> </tr> <tr> <td>3rd person</td> <td>sie wurden</td> </tr> <tr> <td><em>Formal</em></td> <td>Sie wurden</td> </tr> </tbody> </table> </div> <p> </p> </div>
<h2 dir="auto"> Present perfect with "sein" </h2>*<div class="richtext-content-container"> <p>The present perfect is usually made from the auxiliary verb <em>haben</em> and the past participle. However, certain verbs are not used with <em>haben</em>, but with <em>sein</em>.</p> <p><strong>Verbs that form the present perfect with <em>sein are</em>  …</strong></p> <p>... verbs that express movement in a particular direction or a change of location, e.g. <em>gehen</em>, <em>fahren</em>, <em>fliegen</em>, <em>schwimmen</em> and <em>reisen</em><em>.</em><br/> <strong>schwimmen</strong><em>: Wir <strong>sind</strong> im See <strong>geschwommen</strong>.</em></p> <p>... verbs that indicate a change of state or describe an event that one cannot control, e.g. <em>einschlafen</em><em>,</em><em> aufwachen</em> and<em> passieren</em>.<br/> <strong>einschlafen</strong><em>: Ich <strong>bin</strong> am Samstag spät <strong>eingeschlafen</strong>. </em><br/> <strong>aufwachen</strong><em>: Am Sonntag <strong>bin</strong> ich erst um 11:00 Uhr <strong>aufgewacht</strong>.</em></p> <p>... the verbs <em>sein, bleiben</em> and <em>werden</em>.<br/> <strong>sein</strong><em>: Wir <strong>sind</strong> in der Nähe von Hamburg <strong>gewesen</strong>. </em>(But as you already know, the verb <em>sein</em> is normally used in the simple past if you want to express something that happened in the past.)<br/> <strong>bleiben</strong><em>: Wir <strong>sind</strong> drei Tage bei meinem Onkel <strong>geblieben</strong>.</em><br/> <strong>werden</strong><em>: Am Anfang war es sonnig, aber dann <strong>ist</strong> das Wetter immer schlechter <strong>geworden</strong>.</em></p> <p><strong>Verbs that form the present perfect with <em>haben</em> are …</strong></p> <p>... all other verbs (especially verbs that can have an accusative object, e.g. <em>machen)</em><br/> <strong>machen:</strong> <em>Wir <strong>haben</strong> </em>einen Spaziergang<em> <strong>gemacht</strong>.</em></p> </div>
<h2 dir="auto"> Simple past: können, wollen </h2>*<div class="richtext-content-container"> <p><em>Nicos Großmutter <strong>konnte</strong> nicht studieren.<br/> Selmas Großmutter <strong>wollte</strong> zur Schule gehen.</em></p> <p>The simple past of modal verbs is made by adding <em>-te-</em> to the root verb, followed by the ending that corresponds to the person doing the action. Modal verbs do not take an umlaut in the simple past. Here are the simple past forms of the modal verbs <em>können</em> and <em>wollen</em>:<br/> <br/> <em>können </em>(in simple past)<em>:</em></p> <div class="tab-wrap"> <table> <tbody> <tr> <td><em>Singular</em></td> <td> </td> </tr> <tr> <td>1st person</td> <td><em>ich konn<strong>te</strong></em></td> </tr> <tr> <td>2nd person</td> <td><em>du konn<strong>test</strong></em></td> </tr> <tr> <td>3rd person</td> <td><em>er/sie/es konn<strong>te</strong></em></td> </tr> <tr> <td><em>Plural</em></td> <td> </td> </tr> <tr> <td>1st person</td> <td><em>wir konn<strong>ten</strong></em></td> </tr> <tr> <td>2nd person</td> <td><em>ihr konn<strong>tet</strong></em></td> </tr> <tr> <td>3rd person</td> <td><em>sie konn<strong>ten</strong></em></td> </tr> <tr> <td><em>Formal</em></td> <td><em>Sie konn<strong>ten</strong></em></td> </tr> </tbody> </table> </div> <p> </p> <p><em>wollen </em>(in simple past)<em>:</em></p> <div class="tab-wrap"> <table> <tbody> <tr> <td><em>Singular</em></td> <td> </td> </tr> <tr> <td>1st person</td> <td>ich woll<strong>te</strong></td> </tr> <tr> <td>2nd person</td> <td>du woll<strong>test</strong></td> </tr> <tr> <td>3rd person</td> <td>er/sie/es woll<strong>te</strong></td> </tr> <tr> <td><em>Plural</em></td> <td> </td> </tr> <tr> <td>1st person</td> <td>wir woll<strong>ten</strong></td> </tr> <tr> <td>2nd person</td> <td>ihr woll<strong>tet</strong></td> </tr> <tr> <td>3rd person</td> <td>sie woll<strong>ten</strong></td> </tr> <tr> <td><em>Formal</em></td> <td>Sie woll<strong>ten</strong></td> </tr> </tbody> </table> </div> <p> </p> </div>
<h2 dir="auto"> Simple past: haben </h2>*<div class="richtext-content-container"> <p>A verb in the simple past indicates that the action took place in the past. You already know the simple past of the verb <em>sein</em>. The verb <em>haben</em> is also often used in the simple past, e.g. when explaining why you arrived late:</p> <p><em>Tut mir leid, mein Auto <strong>hatte</strong> eine Panne.<br/> Tut mir leid, der Bus <strong>hatte</strong> Verspätung.</em></p> <p> </p> <p>Below is another overview of the <strong>present</strong>:</p> <p><em>Mein Auto hat (jetzt) eine Panne.</em></p> <div class="tab-wrap"> <table> <tbody> <tr> <td><em>Singular</em></td> <td> </td> </tr> <tr> <td>1st person</td> <td> ich habe</td> </tr> <tr> <td>2nd person</td> <td> du hast</td> </tr> <tr> <td>3rd person</td> <td> er/sie/es hat</td> </tr> <tr> <td><em>Plural</em></td> <td> </td> </tr> <tr> <td>1st person</td> <td> wir haben</td> </tr> <tr> <td>2nd person</td> <td> ihr habt</td> </tr> <tr> <td>3rd person</td> <td> sie haben</td> </tr> <tr> <td><em>Formal</em></td> <td> Sie haben</td> </tr> </tbody> </table> </div> <p> </p> <p>The <strong>simple past</strong> is formed like this:</p> <p><em>Mein Auto hatte (gestern) eine Panne.</em></p> <div class="tab-wrap"> <table> <tbody> <tr> <td><em>Singular</em></td> <td> </td> </tr> <tr> <td>1st person</td> <td> ich <strong>hatte</strong></td> </tr> <tr> <td>2nd person</td> <td> du hattest</td> </tr> <tr> <td>3rd person</td> <td> er/sie/es <strong>hatte</strong></td> </tr> <tr> <td><em>Plural</em></td> <td> </td> </tr> <tr> <td>1st person</td> <td> wir hatten</td> </tr> <tr> <td>2nd person</td> <td> ihr hattet</td> </tr> <tr> <td>3rd person</td> <td> sie hatten</td> </tr> <tr> <td><em>Formal</em></td> <td> Sie hatten</td> </tr> </tbody> </table> </div> <p> </p> <div class="tab-wrap"> <table> <tbody> <tr> <td> <p>Grammatical terms in German:</p> <p>das Präsens:  The present is a verb tense. It is used when we are talking about events, activities or situations that take place in the present or are ongoing.    </p> das Präteritum: The simple past is a verb tense. It is used mainly in written language to describe events, activities or situations that took place in the past. Certain verbs, e.g. <em>haben</em> are also used in the simple past in spoken language.</td> </tr> </tbody> </table> </div> </div>
<h2 dir="auto"> Past participle: irregular </h2>*<div class="richtext-content-container"> <p>Even in the past participle form, most irregular verbs begin with <em>ge-</em>. In many verbs, however, there is a stem change. The participle form of irregular verbs ends most often in <em>-en</em>.</p> <div class="tab-wrap"> <table> <tbody> <tr> <td>Infinitive</td> <td>Past participle</td> </tr> <tr> <td>f<strong>a</strong>hren</td> <td><em>ge-</em>f<strong>a</strong>hr<strong><em>-en</em></strong></td> </tr> <tr> <td>fl<strong>ie</strong>gen</td> <td><em>ge-</em>fl<strong>o</strong>g<strong><em>-en</em></strong></td> </tr> <tr> <td>s<strong>i</strong>ngen</td> <td><em>ge-</em>s<strong>u</strong>ng<strong><em>-en</em></strong></td> </tr> <tr> <td>bl<strong>ei</strong>ben</td> <td><em>ge-</em>bl<strong>ie</strong>b<strong><em>-en</em></strong></td> </tr> </tbody> </table> </div> <p> </p> <p>As you can see, there really are not any rules for if and how a vowel in the root will change in this tense, which is why you have to memorize irregular verbs.</p> <p> </p> <p>Verbs which do not have separable prefixes create the past participle without <em>ge-</em>:</p> <div class="tab-wrap"> <table> <tbody> <tr> <td>Infinitive</td> <td>Past participle</td> </tr> <tr> <td>beg<strong>i</strong>nnen</td> <td>beg<strong>o</strong>nn<strong><em>-en</em></strong></td> </tr> <tr> <td>verg<strong>e</strong>ssen</td> <td>verg<strong>e</strong>ss<strong><em>-en</em></strong></td> </tr> <tr> <td>verl<strong>ie</strong>ren</td> <td>verl<strong>o</strong>r<strong><em>-en</em></strong></td> </tr> </tbody> </table> </div> <p> </p> <p>There are a few irregular verbs in the past participle tense that evidence special characteristics. These forms will likewise need to be memorized.</p> <p>Here are a few examples:</p> <div class="tab-wrap"> <table> <tbody> <tr> <td>Infinitive</td> <td>Past participle</td> </tr> <tr> <td>essen</td> <td><em>ge-</em><strong>g</strong>ess<strong><em>-en</em></strong></td> </tr> <tr> <td>g<strong>eh</strong>en</td> <td><em>ge</em>-<strong>gang<em>-en</em></strong></td> </tr> <tr> <td>w<strong>i</strong>ssen</td> <td><em>ge-</em>w<strong>u</strong>ss<strong>-<em>t</em></strong></td> </tr> <tr> <td>verst<strong>eh</strong>en</td> <td>verst<strong>and<em>-en</em></strong></td> </tr> </tbody> </table> </div> <p> </p> <p> </p> <div class="tab-wrap"> <table> <tbody> <tr> <td> <p>Grammar concepts in German:</p> <p>regelmäßig: A grammatic form is regular when it is created following an established pattern that can be transferred to other words.</p> <p>unregelmäßig: Irregular forms are those which need to be memorized, as there is no set rule for how one goes from the base form of the verb to the new form. Irregular forms are those which contain special characteristics that do not follow the set rules. </p> </td> </tr> </tbody> </table> </div> <p> </p> <p> </p> </div>
<h2 dir="auto"> Past participles: regular </h2>*<div class="richtext-content-container"> <p>With regular verbs, the past participle usually begins with the prefix <em>ge-;</em> then comes the verb root, followed by a <em>-t </em>at the end.</p> <div class="tab-wrap"> <table> <tbody> <tr> <td>Infinitive</td> <td>Past participle</td> </tr> <tr> <td>machen </td> <td><strong>ge</strong>-mach<strong>-t</strong></td> </tr> <tr> <td>frühstücken </td> <td><strong>ge</strong>-frühstück-<strong>t</strong></td> </tr> <tr> <td>kochen</td> <td><strong>ge</strong>-koch<strong>-t</strong></td> </tr> </tbody> </table> </div> <p> </p> <p> </p> <p>If the verb root ends in <em>-t</em> or <em>-d</em>, an additional <em>e </em>is added. This extra <em>e</em> is also added after a cluster of consonants. Often, you will be able to identify when an <em>e</em> is necessary, as without it, the word would be hard to say.</p> <div class="tab-wrap"> <table> <tbody> <tr> <td>Infinitive</td> <td>Past participle</td> </tr> <tr> <td> <p>arbei<strong><em>t</em></strong>en</p> </td> <td> <p><strong>ge-</strong>arbeit<strong>-<em>e</em>t</strong></p> </td> </tr> <tr> <td>ö<strong><em>ffn</em></strong>en</td> <td><strong>ge-</strong>öffn<strong>-<em>e</em>t</strong></td> </tr> </tbody> </table> </div> <p> </p> <p>Some verbs make the past participle without <em>ge-</em>:</p> <ul> <li>Verbs which end in <em>-ieren</em></li> <li>Verbs with inseparable prefixes, i.e. <em>be-</em>, <em>ent-</em>, <em>er-</em>, <em>ver-</em>, <em>zer</em>-</li> </ul> <div class="tab-wrap"> <table> <tbody> <tr> <td>Infinitive </td> <td>Past participle </td> </tr> <tr> <td> <p>fotografieren</p> </td> <td> <p>fotografier<strong>-t</strong></p> </td> </tr> <tr> <td> <p>reservieren</p> </td> <td> <p>reservier<strong>-t</strong></p> </td> </tr> <tr> <td>besuchen</td> <td>besuch<strong>-t</strong></td> </tr> </tbody> </table> </div> <p> </p> <div class="tab-wrap"> <table> <tbody> <tr> <td> <p>Grammatical terms in German:</p> das Partizip II: The past participle is formed from a verb and resembles an adjective. It is used in a variety of grammatical structures, for example to form the present perfect tense.</td> </tr> </tbody> </table> </div> </div>
<h2 dir="auto"> Simple past: müssen, dürfen </h2>*<div class="richtext-content-container"> <p><em>Jacques <strong>musste</strong> seinen Eltern früher viel helfen.<br/> Inge <strong>durfte</strong> früher erst nach der Hausarbeit spielen.</em></p> <p> </p> <p><strong>Simple past</strong></p> <p><br/> The simple past is the verb tense used to express something that happened in the past. For the most part, it is used in written language, for example, in newspapers or books. The simple past of the auxiliary verbs <em>sein</em>, and <em>haben</em> and that of the modal verbs, for example, <em>müssen</em> and <em>dürfen</em> are also used in spoken German.<br/> <br/> <br/> <strong>Simple past with the modal verbs:</strong> <strong><em>müssen, dürfen</em></strong><br/> <br/> The simple past of modal verbs is made by adding <em>-te-</em> to the root verb, followed by the ending that corresponds to the person performing the action. Modal verbs do not take an umlaut in the simple past. The simple past forms of the modal verbs <em>müssen</em> and <em>dürfen</em> are listed below:<br/> <br/> <em>müssen </em>(simple past)<em>:</em></p> <div class="tab-wrap"> <table> <tbody> <tr> <td><em>Singular</em></td> <td> </td> </tr> <tr> <td>1st  person</td> <td><em>ich muss<strong>te</strong></em></td> </tr> <tr> <td>2nd person</td> <td><em>du muss<strong>te</strong>st</em></td> </tr> <tr> <td>3rd person</td> <td><em>er/sie/es muss<strong>te</strong></em></td> </tr> <tr> <td><em>Plural</em></td> <td> </td> </tr> <tr> <td>1st person</td> <td><em>wir muss<strong>te</strong>n</em></td> </tr> <tr> <td>2nd person</td> <td><em>ihr muss<strong>te</strong>t</em></td> </tr> <tr> <td>3rd person</td> <td><em>sie muss<strong>te</strong>n</em></td> </tr> <tr> <td><em>Formal</em></td> <td><em>Sie muss<strong>te</strong>n</em></td> </tr> </tbody> </table> </div> <p><br/> <em>dürfen </em>(simple past)<em>:</em></p> <div class="tab-wrap"> <table> <tbody> <tr> <td><em>Singular</em></td> <td> </td> </tr> <tr> <td>1st person</td> <td><em>ich durf<strong>te</strong></em></td> </tr> <tr> <td>2nd person</td> <td><em>du durf<strong>te</strong>st</em></td> </tr> <tr> <td>3rd person</td> <td><em>er/sie/es durf<strong>te</strong></em></td> </tr> <tr> <td><em>Plural</em></td> <td> </td> </tr> <tr> <td>1st person</td> <td><em>wir durf<strong>te</strong>n</em></td> </tr> <tr> <td>2nd person</td> <td><em>ihr durf<strong>te</strong>t</em></td> </tr> <tr> <td>3rd person</td> <td><em>sie durf<strong>te</strong>n</em></td> </tr> <tr> <td><em>Formal</em></td> <td><em>Sie durf<strong>te</strong>n</em></td> </tr> </tbody> </table> </div> <p> </p> </div>
<h2 dir="auto"> Present perfect with "haben" </h2>*<div class="richtext-content-container"> <p> <picture> <source media="(min-width: 1024px)" srcset="/image/37786134_507.jpg"> <source media="(min-width: 768px)" srcset="/image/37786134_505.jpg"> <source media="(min-width: 480px)" srcset="/image/37786134_503.jpg"> <img alt="Deutschkurse | Nicos Weg | A1_E13_L1_S4_Foto3" class="img-responsive" src="/image/37786134_507.jpg"/> </source></source></source></picture></p> <p><em>Gestern <strong>haben</strong> wir eine Wanderung <strong>gemacht</strong>. </em></p> <p>This sentence is in the present perfect tense. In spoken German, this tense is generally used to express something that took place in the past.</p> <p>The present perfect consists of two parts:</p> <p>a) In second position in the sentence there is an auxiliary verb, usually the verb <em>haben.</em> It is conjugated as in the present tense.</p> <p>b) The action that is being described in the sentence is expressed with the second verb, which comes at the end of the sentence. This verb takes a special form known as the past participle. Most past participles begins with the prefix <em>ge-</em><em>.</em> In present perfect sentences, the past participle is an infinitive verb form, meaning it is not conjugated.</p> <p> </p> <p><strong>Present perfect:</strong><strong> <em>haben</em></strong> (conjugated)<strong> + <em>past participle:</em></strong></p> <p><em>Was <strong>habt</strong> ihr gestern <strong>gemacht</strong>?<br/> Wir <strong>haben</strong> eine Wanderung <strong>gemacht</strong>.</em></p> <p> </p> <div class="tab-wrap"> <table> <tbody> <tr> <td> <p>Grammatical terms in German:</p> <p><span style="background-color:transparent">das Perfekt: The present perfect is a tense used to described the past. It comprises a conjugated auxiliary verb (</span><em>haben</em><span style="background-color:transparent"> or </span><em>sein</em><span style="background-color:transparent">) and the past participle.</span></p> </td> </tr> </tbody> </table> </div> </div>
<h2 dir="auto"> Simple past or present perfect? </h2>*<div class="richtext-content-container"> <p>To express something that happened in the past, we can use the simple past or the present perfect tense. Basically, both forms are correct, but one or the other is usually preferable.</p> <p>The simple past …</p> <ul> <li>is used for the most part in written language, i.e. newspaper articles and literature.</li> <li>of<em> sein</em>, <em>haben</em> and modal verbs is also used in spoken language.</li> </ul> <p> </p> <p>The present perfect …</p> <ul> <li>is used above all in spoken language and in informal texts (i.e. private emails)</li> <li>of <em>sein</em>, <em>haben</em> and modal verbs is only rarely used.</li> </ul> </div>
<h2 dir="auto"> Simple past: sein </h2>*<div class="richtext-content-container"> <p>The simple past (also called preterite) is a grammatical tense used to express something in the past. It is mostly used in written language, e.g. in newspaper articles and literature.</p> <p>The verbs <em>sein</em> and <em>haben,</em> however, are often used in spoken language in the simple past tense too.</p> <p><strong>Present tense: </strong></p> <p> <picture> <source media="(min-width: 1024px)" srcset="/image/38290092_507.jpg"> <source media="(min-width: 768px)" srcset="/image/38290092_505.jpg"> <source media="(min-width: 480px)" srcset="/image/38290092_503.jpg"> <img alt="Deutschkurse | Nicos Weg | Grammatik_A1_E4_L1_S1_Foto1" class="img-responsive" src="/image/38290092_507.jpg"/> </source></source></source></picture></p> <p><strong>Simple past: </strong></p> <p> <picture> <source media="(min-width: 1024px)" srcset="/image/38290072_507.jpg"> <source media="(min-width: 768px)" srcset="/image/38290072_505.jpg"> <source media="(min-width: 480px)" srcset="/image/38290072_503.jpg"> <img alt="Deutschkurse | Nicos Weg | Grammatik_A1_E4_L1_S1_Foto2" class="img-responsive" src="/image/38290072_507.jpg"/> </source></source></source></picture></p> <p>Here is a review of the present tense:</p> <div class="tab-wrap"> <table> <tbody> <tr> <td><em>Singular</em></td> <td> </td> </tr> <tr> <td>1st person</td> <td>ich bin</td> </tr> <tr> <td>2nd person</td> <td>du bist</td> </tr> <tr> <td>3rd person</td> <td>er/sie/es ist</td> </tr> <tr> <td><em>Plural</em></td> <td> </td> </tr> <tr> <td>1st person</td> <td>wir sind</td> </tr> <tr> <td>2nd person</td> <td>ihr seid</td> </tr> <tr> <td>3rd person</td> <td>sie sind</td> </tr> <tr> <td><em>Formal (singular and plural)</em></td> <td>Sie sind</td> </tr> </tbody> </table> </div> <p><br/> The simple past is formed as follows:</p> <div class="tab-wrap"> <table> <tbody> <tr> <td><em>Singular</em></td> <td> </td> </tr> <tr> <td>1st person</td> <td>ich <strong>war</strong></td> </tr> <tr> <td>2nd person</td> <td>du <strong>warst</strong></td> </tr> <tr> <td>3rd person</td> <td>er/sie/es <strong>war</strong></td> </tr> <tr> <td><em>Plural</em></td> <td> </td> </tr> <tr> <td>1st person</td> <td>wir <strong>waren</strong></td> </tr> <tr> <td>2nd person</td> <td>ihr <strong>wart</strong></td> </tr> <tr> <td>3rd person</td> <td>sie <strong>waren</strong></td> </tr> <tr> <td><em>Formal (singular and plural)</em></td> <td>Sie waren</td> </tr> </tbody> </table> </div> <p> </p> <div class="tab-wrap"> <table> <tbody> <tr> <td> <p>Grammatical terms in German:</p> <p>das Präsens: The present is a verb tense. It is used when speaking about events, activities or situations that occur in the present or are ongoing.</p> das Präteritum: The simple past is a verb tense. It is used in written language to describe events, activities or situations that happened in the past. The simple past of certain verbs, e.g. <em>sein</em>, is often also used in spoken language.</td> </tr> </tbody> </table> </div> <p> </p> </div>
<h2 dir="auto"> Indefinite or definite? </h2>*<div class="richtext-content-container"> <p><em>Das ist <strong>eine</strong> Tasche. </em></p> <p>The indefinite article is used …</p> <ul> <li>when we are talking about the type of object or person being referred to in general.</li> <li>when the object or person is not yet known and has not been mentioned before.</li> </ul> <p> </p> <p><em>Das ist <strong>die</strong> Tasche von Jenny.</em></p> <p>The definite article is used …</p> <ul> <li>when talking about a particular object or person that is already known to the speaker or listener.</li> <li>when further information is known about a person or an object, e.g. to whom it belongs.</li> </ul> <p> </p> <div class="tab-wrap"> <table> <tbody> <tr> <td> <p>Grammatical terms in German:</p> <p>der bestimmte Artikel: The articles <em>der</em>, <em>die</em>,<em> das </em>are definite articles.</p> der unbestimmte Artikel: The articles <em>ein</em>,<em> eine</em> are indefinite articles.</td> </tr> </tbody> </table> </div> </div>
